codigo_loc_completa,loc_completa
120010081,Amatillo_ Acapulco de Juárez_ Guerrero
120230001,Cuajinicuilapa_ Cuajinicuilapa_ Guerrero
120510001,Quechultenango_ Quechultenango_ Guerrero
120100001,Atlixtac_ Atlixtac_ Guerrero
120380023,El Coacoyul_ Zihuatanejo de Azueta_ Guerrero
120460007,Cochoapa_ Ometepec_ Guerrero
120750008,Huitziltepec_ Eduardo Neri_ Guerrero
120110071,El Ticui_ Atoyac de Álvarez_ Guerrero
120380013,San José Ixtapa (Barrio Viejo)_ Zihuatanejo de Azueta_ Guerrero
120680001,La Unión_ La Unión de Isidoro Montes de Oca_ Guerrero
120250001,Cuautepec_ Cuautepec_ Guerrero
120010158,San Pedro las Playas_ Acapulco de Juárez_ Guerrero
120360001,Igualapa_ Igualapa_ Guerrero
120210062,Tixtlancingo_ Coyuca de Benítez_ Guerrero
120620001,Tlacoachistlahuaca_ Tlacoachistlahuaca_ Guerrero
120460016,Huixtepec_ Ometepec_ Guerrero
120760001,Acatepec_ Acatepec_ Guerrero
120180001,Copala_ Copala_ Guerrero
120430001,Metlatónoc_ Metlatónoc_ Guerrero
120200001,Copanatoyac_ Copanatoyac_ Guerrero
120520008,Cuanacaxtitlán_ San Luis Acatlán_ Guerrero
120550002,Acamixtla_ Taxco de Alarcón_ Guerrero
120440001,Mochitlán_ Mochitlán_ Guerrero
120560048,Xalpatláhuac_ Tecoanapa_ Guerrero
120750013,Mezcala_ Eduardo Neri_ Guerrero
120270001,Cutzamala de Pinzón_ Cutzamala de Pinzón_ Guerrero
120460002,Acatepec_ Ometepec_ Guerrero
120280058,Pantitlán_ Chilapa de Álvarez_ Guerrero
120010166,Tres Palos_ Acapulco de Juárez_ Guerrero
120410001,Malinaltepec_ Malinaltepec_ Guerrero
120550039,Acuitlapán_ Taxco de Alarcón_ Guerrero
120570086,El Súchil_ Técpan de Galeana_ Guerrero
120670017,San José Poliutla_ Tlapehuala_ Guerrero
120030017,Changata_ Ajuchitlán del Progreso_ Guerrero
120590008,Mayanalán_ Tepecoacuilco de Trujano_ Guerrero
120610006,Atliaca_ Tixtla de Guerrero_ Guerrero
120350007,Coacoyula de Álvarez_ Iguala de la Independencia_ Guerrero
120110043,El Paraíso_ Atoyac de Álvarez_ Guerrero
120450015,Temalacatzingo_ Olinalá_ Guerrero
120290043,Mazatlán_ Chilpancingo de los Bravo_ Guerrero
120630001,Tlacoapa_ Tlacoapa_ Guerrero
120650001,Tlalixtaquilla_ Tlalixtaquilla de Maldonado_ Guerrero
120340047,Tulimán_ Huitzuco de los Figueroa_ Guerrero
120720001,Zapotitlán Tablas_ Zapotitlán Tablas_ Guerrero
120020001,Ahuacuotzingo_ Ahuacuotzingo_ Guerrero
120010687,Huerta Marcelino Flores Bailón_ Acapulco de Juárez_ Guerrero
120690001,Xalpatláhuac_ Xalpatláhuac_ Guerrero
120350018,Santa Teresa_ Iguala de la Independencia_ Guerrero
120230026,San Nicolás_ Cuajinicuilapa_ Guerrero
120530039,Las Mesas_ San Marcos_ Guerrero
120710006,Guadalupe Victoria_ Xochistlahuaca_ Guerrero
120780001,Cochoapa el Grande_ Cochoapa el Grande_ Guerrero
120290463,Tlacolotlán_ Chilpancingo de los Bravo_ Guerrero
120750023,Xochipala_ Eduardo Neri_ Guerrero
120030058,Villa Nicolás Bravo_ Ajuchitlán del Progreso_ Guerrero
120400019,Yextla_ Leonardo Bravo_ Guerrero
120310001,Acapetlahuaya_ General Canuto A. Neri_ Guerrero
120680051,El Naranjito_ La Unión de Isidoro Montes de Oca_ Guerrero
130480001,Pachuca de Soto_ Pachuca de Soto_ Hidalgo
130610002,Fray Bernardino de Sahagún (Ciudad Sahagún)_ Tepeapulco_ Hidalgo
130690042,Don Antonio_ Tizayuca_ Hidalgo
130690001,Tizayuca_ Tizayuca_ Hidalgo
130280001,Huejutla de Reyes_ Huejutla de Reyes_ Hidalgo
130770053,Javier Rojo Gómez_ Tulancingo de Bravo_ Hidalgo
130660008,Benito Juárez_ Villa de Tezontepec_ Hidalgo
130510001,Pachuquilla_ Mineral de la Reforma_ Hidalgo
130770020,Santa María Asunción_ Tulancingo de Bravo_ Hidalgo
130470001,Pacula_ Pacula_ Hidalgo
130290001,Huichapan_ Huichapan_ Hidalgo
130840001,Zimapán_ Zimapán_ Hidalgo
130760008,El Llano_ Tula de Allende_ Hidalgo
130760022,San Marcos_ Tula de Allende_ Hidalgo
130460027,Huitzitzilingo_ San Felipe Orizatlán_ Hidalgo
130290024,San José Atlán_ Huichapan_ Hidalgo
130280088,Tehuetlán_ Huejutla de Reyes_ Hidalgo
130690008,Huitzila_ Tizayuca_ Hidalgo
130630020,Tianguistengo (La Romera)_ Tepeji del Río de Ocampo_ Hidalgo
130560001,Santiago Tulantepec_ Santiago Tulantepec de Lugo Guerrero_ Hidalgo
130080001,Apan_ Apan_ Hidalgo
130300001,Ixmiquilpan_ Ixmiquilpan_ Hidalgo
130670010,San Gabriel_ Tezontepec de Aldama_ Hidalgo
130670003,Atengo_ Tezontepec de Aldama_ Hidalgo
130630001,Tepeji del Río de Ocampo_ Tepeji del Río de Ocampo_ Hidalgo
130670001,Tezontepec de Aldama_ Tezontepec de Aldama_ Hidalgo
130300048,El Tephé_ Ixmiquilpan_ Hidalgo
130760001,Tula de Allende_ Tula de Allende_ Hidalgo
130030001,Actopan_ Actopan_ Hidalgo
130700001,Tlahuelilpan_ Tlahuelilpan_ Hidalgo
130670008,Panuaya_ Tezontepec de Aldama_ Hidalgo
130500001,Progreso de Obregón_ Progreso de Obregón_ Hidalgo
130760024,San Miguel Vindho_ Tula de Allende_ Hidalgo
130160001,Cuautepec_ Cuautepec de Hinojosa_ Hidalgo
130150001,Cardonal_ Cardonal_ Hidalgo
130810001,Zacualtipán_ Zacualtipán de Ángeles_ Hidalgo
130110001,Atlapexco_ Atlapexco_ Hidalgo
130130006,Conejos_ Atotonilco de Tula_ Hidalgo
130270034,San Antonio el Grande_ Huehuetla_ Hidalgo
130320001,Jaltocán_ Jaltocán_ Hidalgo
130450001,Omitlán de Juárez_ Omitlán de Juárez_ Hidalgo
130010001,Acatlán_ Acatlán_ Hidalgo
130760026,Santa Ana Ahuehuepan_ Tula de Allende_ Hidalgo
130280042,Chililico_ Huejutla de Reyes_ Hidalgo
130210001,Emiliano Zapata_ Emiliano Zapata_ Hidalgo
130510110,Los Pinos_ Mineral de la Reforma_ Hidalgo
130410001,Mixquiahuala de Juárez_ Mixquiahuala de Juárez_ Hidalgo
130510102,Industrial la Paz_ Mineral de la Reforma_ Hidalgo
130670006,Mangas_ Tezontepec de Aldama_ Hidalgo
130050001,Ajacuba_ Ajacuba_ Hidalgo
130830001,Zempoala_ Zempoala_ Hidalgo
130540019,San Antonio Zaragoza_ San Salvador_ Hidalgo
130690010,El Cid_ Tizayuca_ Hidalgo
130800001,Yahualica_ Yahualica_ Hidalgo
130510139,El Saucillo Fraccionamiento_ Mineral de la Reforma_ Hidalgo
130070001,Almoloya_ Almoloya_ Hidalgo
130510012,San Guillermo la Reforma_ Mineral de la Reforma_ Hidalgo
130740001,Tlaxcoapan_ Tlaxcoapan_ Hidalgo
130230001,Tepatepec_ Francisco I. Madero_ Hidalgo
130750001,Tolcayuca_ Tolcayuca_ Hidalgo
130510055,PRI Chacón_ Mineral de la Reforma_ Hidalgo
130510147,Unidad Minera 11 de Julio_ Mineral de la Reforma_ Hidalgo
130660001,Tezontepec_ Villa de Tezontepec_ Hidalgo
130570001,Singuilucan_ Singuilucan_ Hidalgo
130510027,La Providencia Siglo XXI_ Mineral de la Reforma_ Hidalgo
130250001,Huautla_ Huautla_ Hidalgo
130460004,Ahuatitla_ San Felipe Orizatlán_ Hidalgo
130610001,Tepeapulco_ Tepeapulco_ Hidalgo
130530001,San Bartolo Tutotepec_ San Bartolo Tutotepec_ Hidalgo
130510096,La Colonia_ Mineral de la Reforma_ Hidalgo
130360001,Mezquititlán_ San Agustín Metzquititlán_ Hidalgo
130520001,San Agustín Tlaxiaca_ San Agustín Tlaxiaca_ Hidalgo
130510004,Carboneras_ Mineral de la Reforma_ Hidalgo
130510078,Los Tuzos_ Mineral de la Reforma_ Hidalgo
130380001,Mineral del Chico_ Mineral del Chico_ Hidalgo
130690044,Haciendas de Tizayuca_ Tizayuca_ Hidalgo
130510127,Rinconadas del Venado II_ Mineral de la Reforma_ Hidalgo
130690005,Emiliano Zapata_ Tizayuca_ Hidalgo
130490001,Pisaflores_ Pisaflores_ Hidalgo
130830133,Privadas Santa Matilde_ Zempoala_ Hidalgo
130350001,Metepec_ Metepec_ Hidalgo
130040001,Agua Blanca de Iturbide_ Agua Blanca de Iturbide_ Hidalgo
130020013,Santa Ana Tzacuala_ Acaxochitlán_ Hidalgo
130370001,Metztitlán_ Metztitlán_ Hidalgo
130630006,Melchor Ocampo (El Salto)_ Tepeji del Río de Ocampo_ Hidalgo
130420001,Molango de Escamilla_ Molango de Escamilla_ Hidalgo
130020001,Acaxochitlán_ Acaxochitlán_ Hidalgo
130510099,Forjadores de Pachuca_ Mineral de la Reforma_ Hidalgo
130390001,Mineral del Monte_ Mineral del Monte_ Hidalgo
130400001,La Misión_ La Misión_ Hidalgo
130830023,Jagüey de Téllez (Estación Téllez)_ Zempoala_ Hidalgo
130620001,Tepehuacán de Guerrero_ Tepehuacán de Guerrero_ Hidalgo
130710001,Tlahuiltepa_ Tlahuiltepa_ Hidalgo
130560005,El Pedregal de San José_ Santiago Tulantepec de Lugo Guerrero_ Hidalgo
130770068,Parque Urbano Napateco_ Tulancingo de Bravo_ Hidalgo
130100001,Atitalaquia_ Atitalaquia_ Hidalgo
130740003,Teltipán de Juárez_ Tlaxcoapan_ Hidalgo
130510123,Privada Quinta Bonita_ Mineral de la Reforma_ Hidalgo
130590001,Tecozautla_ Tecozautla_ Hidalgo
130510091,El Álamo_ Mineral de la Reforma_ Hidalgo
130510054,Unidad Habitacional Dina-Sidena Chacón_ Mineral de la Reforma_ Hidalgo
130180001,Chapulhuacán_ Chapulhuacán_ Hidalgo
130600001,Tenango de Doria_ Tenango de Doria_ Hidalgo
130770010,Jaltepec_ Tulancingo de Bravo_ Hidalgo
130200001,Eloxochitlán_ Eloxochitlán_ Hidalgo
130820003,San Pedro Huaquilpan_ Zapotlán de Juárez_ Hidalgo
130480158,Santiago Tlapacoya_ Pachuca de Soto_ Hidalgo
130650001,Tetepango_ Tetepango_ Hidalgo
130460001,San Felipe Orizatlán_ San Felipe Orizatlán_ Hidalgo
130510146,Villas del Álamo_ Mineral de la Reforma_ Hidalgo
130300035,Panales_ Ixmiquilpan_ Hidalgo
130130013,Vito_ Atotonilco de Tula_ Hidalgo
130800017,Santa Teresa_ Yahualica_ Hidalgo
130750002,General Felipe Ángeles (Los Ángeles)_ Tolcayuca_ Hidalgo
130510141,Tulipanes_ Mineral de la Reforma_ Hidalgo
130820001,Zapotlán de Juárez_ Zapotlán de Juárez_ Hidalgo
130300016,Dios Padre_ Ixmiquilpan_ Hidalgo
130170001,Chapantongo_ Chapantongo_ Hidalgo
130510135,SAHOP Chacón_ Mineral de la Reforma_ Hidalgo
130540032,Caxuxi_ San Salvador_ Hidalgo
130130001,Atotonilco de Tula_ Atotonilco de Tula_ Hidalgo
130610066,Hidalgo [Zona Industrial]_ Tepeapulco_ Hidalgo
130720001,Tlanalapa_ Tlanalapa_ Hidalgo
130090001,El Arenal_ El Arenal_ Hidalgo
130270001,Huehuetla_ Huehuetla_ Hidalgo
130510093,Campestre Villas del Álamo_ Mineral de la Reforma_ Hidalgo
130690019,Tepojaco_ Tizayuca_ Hidalgo
130730001,Tlanchinol_ Tlanchinol_ Hidalgo
130230014,San Juan Tepa_ Francisco I. Madero_ Hidalgo
130510092,Bosques del Mineral_ Mineral de la Reforma_ Hidalgo
130830026,Santiago Tepeyahualco_ Zempoala_ Hidalgo
130740002,Doxey_ Tlaxcoapan_ Hidalgo
130510130,Rinconadas de San Francisco_ Mineral de la Reforma_ Hidalgo
130510126,Rinconadas del Venado I_ Mineral de la Reforma_ Hidalgo
130100002,Cardonal_ Atitalaquia_ Hidalgo
130760011,Bomintzha_ Tula de Allende_ Hidalgo
130630009,San Buenaventura_ Tepeji del Río de Ocampo_ Hidalgo
130770018,Santa Ana Hueytlalpan_ Tulancingo de Bravo_ Hidalgo
130580001,Tasquillo_ Tasquillo_ Hidalgo
130510020,Álamo Rustico_ Mineral de la Reforma_ Hidalgo
130510090,Las Águilas_ Mineral de la Reforma_ Hidalgo
130510095,Cipreses_ Mineral de la Reforma_ Hidalgo
130430001,Nicolás Flores_ Nicolás Flores_ Hidalgo
130640001,Tepetitlán_ Tepetitlán_ Hidalgo
130820002,Acayuca_ Zapotlán de Juárez_ Hidalgo
130680001,Tianguistengo_ Tianguistengo_ Hidalgo
130130010,Progreso_ Atotonilco de Tula_ Hidalgo
130440001,Nopala de Villagrán_ Nopala de Villagrán_ Hidalgo
130550001,Santiago de Anaya_ Santiago de Anaya_ Hidalgo
130690002,El Carmen_ Tizayuca_ Hidalgo
130310001,Jacala_ Jacala de Ledezma_ Hidalgo
130290029,Tlaxcalilla_ Huichapan_ Hidalgo
130050006,San Nicolás Tecomatlán_ Ajacuba_ Hidalgo
130100008,Tlamaco (San Gerónimo Tlamaco)_ Atitalaquia_ Hidalgo
130560036,Unidades Habitacionales_ Santiago Tulantepec de Lugo Guerrero_ Hidalgo
130510134,El Roble_ Mineral de la Reforma_ Hidalgo
130520019,San Juan Tilcuautla_ San Agustín Tlaxiaca_ Hidalgo
130670009,Presas_ Tezontepec de Aldama_ Hidalgo
130540001,San Salvador_ San Salvador_ Hidalgo
130060001,Alfajayucan_ Alfajayucan_ Hidalgo
130790001,Xochicoatlán_ Xochicoatlán_ Hidalgo
130140001,Calnali_ Calnali_ Hidalgo
130780001,Xochiatipan_ Xochiatipan_ Hidalgo
130190001,Chilcuautla_ Chilcuautla_ Hidalgo
130410010,Colonia Teñhe_ Mixquiahuala de Juárez_ Hidalgo
130510107,Manuel Ávila Camacho_ Mineral de la Reforma_ Hidalgo
130510133,Río de la Soledad_ Mineral de la Reforma_ Hidalgo
130510138,San José_ Mineral de la Reforma_ Hidalgo
130510083,Rinconada de los Ángeles_ Mineral de la Reforma_ Hidalgo
130280023,Coacuilco_ Huejutla de Reyes_ Hidalgo
130510029,Santiago Jaltepec_ Mineral de la Reforma_ Hidalgo
130220001,Epazoyucan_ Epazoyucan_ Hidalgo
130260001,Huazalingo_ Huazalingo_ Hidalgo
130230012,El Rosario_ Francisco I. Madero_ Hidalgo
130030014,El Huaxtho_ Actopan_ Hidalgo
130160029,Santa María Nativitas_ Cuautepec de Hinojosa_ Hidalgo
130020007,Los Reyes_ Acaxochitlán_ Hidalgo
130160039,Almoloya_ Cuautepec de Hinojosa_ Hidalgo
130510148,Paseos de Chavarría_ Mineral de la Reforma_ Hidalgo
130480153,El Huixmí_ Pachuca de Soto_ Hidalgo
130510114,Privada del Bosque_ Mineral de la Reforma_ Hidalgo
130760027,Santa María Ilucan_ Tula de Allende_ Hidalgo
130700003,Colonia Cuauhtémoc_ Tlahuelilpan_ Hidalgo
130670005,Huitel_ Tezontepec de Aldama_ Hidalgo
130240001,Huasca de Ocampo_ Huasca de Ocampo_ Hidalgo
130630021,Tinajas_ Tepeji del Río de Ocampo_ Hidalgo
130510033,Nuevo Centro de Población Agrícola el Chacón_ Mineral de la Reforma_ Hidalgo
130510063,Colinas de Plata_ Mineral de la Reforma_ Hidalgo
130050005,Santiago Tezontlale_ Ajacuba_ Hidalgo
130510014,El Saucillo_ Mineral de la Reforma_ Hidalgo
130510157,La Reforma (CANACINTRA) [Parque Industrial]_ Mineral de la Reforma_ Hidalgo
130140010,Papatlatla_ Calnali_ Hidalgo
130510120,Campestre Villas del Álamo (FOVISSSTE)_ Mineral de la Reforma_ Hidalgo
130510060,Abundio Martínez_ Mineral de la Reforma_ Hidalgo
140020002,Bellavista_ Acatlán de Juárez_ Jalisco
140160001,Ayotlán_ Ayotlán_ Jalisco
140300001,Chapala_ Chapala_ Jalisco
140230001,Ciudad Guzmán_ Zapotlán el Grande_ Jalisco
140970001,Tlajomulco de Zúñiga_ Tlajomulco de Zúñiga_ Jalisco
140920001,Teocuitatlán de Corona_ Teocuitatlán de Corona_ Jalisco
140200001,El Tuito_ Cabo Corrientes_ Jalisco
141110001,Valle de Guadalupe_ Valle de Guadalupe_ Jalisco
140700021,San José el Verde (El Verde)_ El Salto_ Jalisco
140830001,Tala_ Tala_ Jalisco
141010001,Tonalá_ Tonalá_ Jalisco
140820001,Sayula_ Sayula_ Jalisco
140140001,Atoyac_ Atoyac_ Jalisco
140970032,San Sebastián el Grande_ Tlajomulco de Zúñiga_ Jalisco
140970025,San Agustín_ Tlajomulco de Zúñiga_ Jalisco
140700111,Galaxia Bonito Jalisco_ El Salto_ Jalisco
140970034,Santa Cruz de las Flores_ Tlajomulco de Zúñiga_ Jalisco
140300005,San Antonio Tlayacapan_ Chapala_ Jalisco
140700014,Las Pintitas_ El Salto_ Jalisco
140050001,Amatitán_ Amatitán_ Jalisco
140970115,La Alameda_ Tlajomulco de Zúñiga_ Jalisco
140650001,Pihuamo_ Pihuamo_ Jalisco
140530001,Lagos de Moreno_ Lagos de Moreno_ Jalisco
140270001,Cuautitlán de García Barragán_ Cuautitlán de García Barragán_ Jalisco
140940001,Tequila_ Tequila_ Jalisco
141240001,Zapotlanejo_ Zapotlanejo_ Jalisco
140500001,Jocotepec_ Jocotepec_ Jalisco
140970853,Valle Dorado Inn_ Tlajomulco de Zúñiga_ Jalisco
140550001,Magdalena_ Magdalena_ Jalisco
140470001,Jamay_ Jamay_ Jalisco
140010001,Acatic_ Acatic_ Jalisco
140020001,Acatlán de Juárez_ Acatlán de Juárez_ Jalisco
141200231,Tesistán (San Francisco Tesistán)_ Zapopan_ Jalisco
140460001,Jalostotitlán_ Jalostotitlán_ Jalisco
140130001,Atotonilco el Alto_ Atotonilco el Alto_ Jalisco
140660001,Poncitlán_ Poncitlán_ Jalisco
141010031,San Francisco de la Soledad (San Francisco)_ Tonalá_ Jalisco
141160001,Villa Hidalgo_ Villa Hidalgo_ Jalisco
140150001,Autlán de Navarro_ Autlán de Navarro_ Jalisco
140060001,Ameca_ Ameca_ Jalisco
140370001,El Grullo_ El Grullo_ Jalisco
141140001,Villa Corona_ Villa Corona_ Jalisco
140180001,La Barca_ La Barca_ Jalisco
140730001,San Juan de los Lagos_ San Juan de los Lagos_ Jalisco
140700001,El Salto_ El Salto_ Jalisco
141000001,Tomatlán_ Tomatlán_ Jalisco
140970836,Hacienda los Fresnos_ Tlajomulco de Zúñiga_ Jalisco
140960001,Tizapán el Alto_ Tizapán el Alto_ Jalisco
140970862,Colinas del Roble_ Tlajomulco de Zúñiga_ Jalisco
140350001,Encarnación de Díaz_ Encarnación de Díaz_ Jalisco
140500017,Zapotitán de Hidalgo_ Jocotepec_ Jalisco
140030001,Ahualulco de Mercado_ Ahualulco de Mercado_ Jalisco
140770001,San Martín Hidalgo_ San Martín Hidalgo_ Jalisco
141100001,Unión de Tula_ Unión de Tula_ Jalisco
140670031,Las Juntas_ Puerto Vallarta_ Jalisco
140360001,Etzatlán_ Etzatlán_ Jalisco
140750001,San Marcos_ San Marcos_ Jalisco
140300002,Ajijic_ Chapala_ Jalisco
140570001,La Manzanilla de la Paz_ La Manzanilla de la Paz_ Jalisco
140880001,Tecolotlán_ Tecolotlán_ Jalisco
140330001,Degollado_ Degollado_ Jalisco
140930001,Tepatitlán de Morelos_ Tepatitlán de Morelos_ Jalisco
140850001,Tamazula de Gordiano_ Tamazula de Gordiano_ Jalisco
140860001,Tapalpa_ Tapalpa_ Jalisco
140210001,La Resolana_ Casimiro Castillo_ Jalisco
141080001,Tuxpan_ Tuxpan_ Jalisco
140970020,Los Gavilanes_ Tlajomulco de Zúñiga_ Jalisco
140220001,Cihuatlán_ Cihuatlán_ Jalisco
140430001,La Huerta_ La Huerta_ Jalisco
140670066,La Desembocada_ Puerto Vallarta_ Jalisco
140220006,Barra de Navidad_ Cihuatlán_ Jalisco
140220016,Jaluco_ Cihuatlán_ Jalisco
140700009,Hacienda Vieja del Castillo (Castillo Viejo)_ El Salto_ Jalisco
140620001,Mixtlán_ Mixtlán_ Jalisco
140640001,Ojuelos de Jalisco_ Ojuelos de Jalisco_ Jalisco
141010009,Coyula_ Tonalá_ Jalisco
140780001,San Miguel el Alto_ San Miguel el Alto_ Jalisco
141200243,La Venta del Astillero_ Zapopan_ Jalisco
141010026,Puente Grande_ Tonalá_ Jalisco
140830004,Cuisillos_ Tala_ Jalisco
140900001,Tenamaxtlán_ Tenamaxtlán_ Jalisco
140730221,Colonia Santa Cecilia (La Sauceda)_ San Juan de los Lagos_ Jalisco
140640032,Matancillas (San Isidro Matancillas)_ Ojuelos de Jalisco_ Jalisco
141190001,Zacoalco de Torres_ Zacoalco de Torres_ Jalisco
141050001,Tototlán_ Tototlán_ Jalisco
140660019,Mezcala_ Poncitlán_ Jalisco
140910071,Mechoacanejo_ Teocaltiche_ Jalisco
141240176,Santa Fe_ Zapotlanejo_ Jalisco
140480001,Jesús María_ Jesús María_ Jalisco
141030001,Tonila_ Tonila_ Jalisco
140670038,Las Palmas de Arriba_ Puerto Vallarta_ Jalisco
140420001,Huejuquilla el Alto_ Huejuquilla el Alto_ Jalisco
140610001,Mezquitic_ Mezquitic_ Jalisco
140430099,San Mateo_ La Huerta_ Jalisco
140600001,Mexticacán_ Mexticacán_ Jalisco
140100001,Atemajac de Brizuela_ Atemajac de Brizuela_ Jalisco
140810001,Santa María de los Ángeles_ Santa María de los Ángeles_ Jalisco
140530066,Paso de Cuarenta (San Miguel de Cuarenta)_ Lagos de Moreno_ Jalisco
140350017,Bajío de San José_ Encarnación de Díaz_ Jalisco
140770015,El Salitre_ San Martín Hidalgo_ Jalisco
140220033,San Patricio (Melaque)_ Cihuatlán_ Jalisco
141000189,José María Pino Suárez (Nuevo Nahuapa)_ Tomatlán_ Jalisco
140430036,Emiliano Zapata_ La Huerta_ Jalisco
141000065,José María Morelos_ Tomatlán_ Jalisco
140210018,Tecomates_ Casimiro Castillo_ Jalisco
140740001,San Julián_ San Julián_ Jalisco
141210001,Zapotiltic_ Zapotiltic_ Jalisco
141020001,Tonaya_ Tonaya_ Jalisco
140580001,Mascota_ Mascota_ Jalisco
140910001,Teocaltiche_ Teocaltiche_ Jalisco
140830016,San Isidro Mazatepec_ Tala_ Jalisco
140970003,Las Asturias [Fraccionamiento]_ Tlajomulco de Zúñiga_ Jalisco
140970833,Villas de la Hacienda [Fraccionamiento]_ Tlajomulco de Zúñiga_ Jalisco
140970831,Real del Valle (El Paraíso) [Fraccionamiento]_ Tlajomulco de Zúñiga_ Jalisco
140980128,Paseo del Prado_ San Pedro Tlaquepaque_ Jalisco
141200430,Campestre las Palomas [Fraccionamiento]_ Zapopan_ Jalisco
141200139,Nextipac_ Zapopan_ Jalisco
141230001,Zapotlán del Rey_ Zapotlán del Rey_ Jalisco
140970180,Palomar_ Tlajomulco de Zúñiga_ Jalisco
140970038,La Unión del Cuatro (San José del Valle)_ Tlajomulco de Zúñiga_ Jalisco
141200524,La Báscula (Kilómetro Trece)_ Zapopan_ Jalisco
140520001,Juchitlán_ Juchitlán_ Jalisco
140990006,Cópala_ Tolimán_ Jalisco
140700020,San José del Castillo_ El Salto_ Jalisco
140970035,Santa Cruz del Valle_ Tlajomulco de Zúñiga_ Jalisco
140160072,La Ribera_ Ayotlán_ Jalisco
140510001,Juanacatlán_ Juanacatlán_ Jalisco
140240001,Cocula_ Cocula_ Jalisco
140300003,Atotonilquillo_ Chapala_ Jalisco
140440002,Atequiza_ Ixtlahuacán de los Membrillos_ Jalisco
141230041,Santiago Totolimixpan (Colonia la Guadalupana)_ Zapotlán del Rey_ Jalisco
140670028,Ixtapa_ Puerto Vallarta_ Jalisco
140930291,San José de Gracia_ Tepatitlán de Morelos_ Jalisco
140090001,El Arenal_ El Arenal_ Jalisco
141090001,Unión de San Antonio_ Unión de San Antonio_ Jalisco
140840001,Talpa de Allende_ Talpa de Allende_ Jalisco
141220001,Zapotitlán de Vadillo_ Zapotitlán de Vadillo_ Jalisco
140970835,Galaxia la Noria_ Tlajomulco de Zúñiga_ Jalisco
140970560,Jardines de San Sebastián_ Tlajomulco de Zúñiga_ Jalisco
140500011,San Juan Cosalá_ Jocotepec_ Jalisco
140170001,Ayutla_ Ayutla_ Jalisco
140290001,Cuquío_ Cuquío_ Jalisco
141140005,Estipac_ Villa Corona_ Jalisco
141130001,San Gabriel_ San Gabriel_ Jalisco
140820026,Usmajac_ Sayula_ Jalisco
141250001,San Ignacio Cerro Gordo_ San Ignacio Cerro Gordo_ Jalisco
140790001,San Sebastián del Sur_ Gómez Farías_ Jalisco
140440001,Ixtlahuacán de los Membrillos_ Ixtlahuacán de los Membrillos_ Jalisco
140260001,Concepción de Buenos Aires_ Concepción de Buenos Aires_ Jalisco
140790030,San Andrés Ixtlán_ Gómez Farías_ Jalisco
140400001,Hostotipaquillo_ Hostotipaquillo_ Jalisco
140090006,Santa Cruz del Astillero_ El Arenal_ Jalisco
140490001,Jilotlán de los Dolores_ Jilotlán de los Dolores_ Jalisco
140440180,La Capilla [Residencial]_ Ixtlahuacán de los Membrillos_ Jalisco
140970041,Zapote del Valle (Zapote de Santa Cruz)_ Tlajomulco de Zúñiga_ Jalisco
140160089,Santa Rita_ Ayotlán_ Jalisco
140080280,Santa María del Valle_ Arandas_ Jalisco
140440005,La Capilla del Refugio_ Ixtlahuacán de los Membrillos_ Jalisco
140660033,Santa Cruz el Grande_ Poncitlán_ Jalisco
140950001,Teuchitlán_ Teuchitlán_ Jalisco
141120001,Valle de Juárez_ Valle de Juárez_ Jalisco
140770022,El Tepehuaje de Morelos_ San Martín Hidalgo_ Jalisco
140380001,Guachinango_ Guachinango_ Jalisco
140430033,Chamela_ La Huerta_ Jalisco
140930188,Capilla de Milpillas (Milpillas)_ Tepatitlán de Morelos_ Jalisco
140430140,Agua Caliente Nueva_ La Huerta_ Jalisco
140540001,El Limón_ El Limón_ Jalisco
140070001,San Juanito de Escobedo_ San Juanito de Escobedo_ Jalisco
140430062,La Manzanilla_ La Huerta_ Jalisco
140970863,La Purísima [Fraccionamiento]_ Tlajomulco de Zúñiga_ Jalisco
141000023,Campo Acosta_ Tomatlán_ Jalisco
140960014,Villa Emiliano Zapata (Ejido Modelo)_ Tizapán el Alto_ Jalisco
141060001,Tuxcacuesco_ Tuxcacuesco_ Jalisco
141170001,Cañadas de Obregón_ Cañadas de Obregón_ Jalisco
140890001,Techaluta de Montenegro_ Techaluta de Montenegro_ Jalisco
140830013,El Refugio_ Tala_ Jalisco
141030015,San Marcos_ Tonila_ Jalisco
140800001,San Sebastián del Oeste_ San Sebastián del Oeste_ Jalisco
140220103,Colonia el Herradero (Camino al Almolón)_ Cihuatlán_ Jalisco
140280001,Cuautla_ Cuautla_ Jalisco
141070001,Tuxcueca_ Tuxcueca_ Jalisco
140430146,Pérula_ La Huerta_ Jalisco
140660011,Cuitzeo (La Estancia)_ Poncitlán_ Jalisco
140850173,Vista Hermosa (Santa Cruz del Cortijo)_ Tamazula de Gordiano_ Jalisco
140990001,Tolimán_ Tolimán_ Jalisco
140760001,San Martín de Bolaños_ San Martín de Bolaños_ Jalisco
140700043,El Quince (San José el Quince)_ El Salto_ Jalisco
141140002,Atotonilco el Bajo_ Villa Corona_ Jalisco
140680001,Villa Purificación_ Villa Purificación_ Jalisco
140660031,San Pedro Itzicán_ Poncitlán_ Jalisco
141240094,La Laja_ Zapotlanejo_ Jalisco
140210003,Lo Arado_ Casimiro Castillo_ Jalisco
141000034,La Cruz de Loreto_ Tomatlán_ Jalisco
140350138,Mesón de los Sauces_ Encarnación de Díaz_ Jalisco
140940124,El Salvador_ Tequila_ Jalisco
141070008,San Luis Soyatlán_ Tuxcueca_ Jalisco
140690001,Quitupan_ Quitupan_ Jalisco
140160010,Betania_ Ayotlán_ Jalisco
140210015,Piedra Pesada_ Casimiro Castillo_ Jalisco
140200070,Yelapa_ Cabo Corrientes_ Jalisco
140340001,Ejutla_ Ejutla_ Jalisco
140930223,Pegueros_ Tepatitlán de Morelos_ Jalisco
140200062,Quimixto_ Cabo Corrientes_ Jalisco
141150001,Villa Guerrero_ Villa Guerrero_ Jalisco
140040001,Amacueca_ Amacueca_ Jalisco
140720001,San Diego de Alejandría_ San Diego de Alejandría_ Jalisco
140770005,El Crucero de Santa María_ San Martín Hidalgo_ Jalisco
141040001,Totatiche_ Totatiche_ Jalisco
140220002,El Aguacate_ Cihuatlán_ Jalisco
140970005,Cajititlán_ Tlajomulco de Zúñiga_ Jalisco
140970006,La Calera_ Tlajomulco de Zúñiga_ Jalisco
140970117,Jardines de la Calera_ Tlajomulco de Zúñiga_ Jalisco
140440010,Los Olivos_ Ixtlahuacán de los Membrillos_ Jalisco
140120001,Atenguillo_ Atenguillo_ Jalisco
140020004,El Plan (El Cerrito)_ Acatlán de Juárez_ Jalisco
140970028,El Refugio_ Tlajomulco de Zúñiga_ Jalisco
140830220,Los Ruiseñores_ Tala_ Jalisco
140450001,Ixtlahuacán del Río_ Ixtlahuacán del Río_ Jalisco
140180027,Portezuelo_ La Barca_ Jalisco
140130030,San Francisco de Asís_ Atotonilco el Alto_ Jalisco
140240007,La Cofradía de la Luz_ Cocula_ Jalisco
140970844,Lomas de San Agustín_ Tlajomulco de Zúñiga_ Jalisco
140470005,San Miguel de la Paz_ Jamay_ Jalisco
140410001,Huejúcar_ Huejúcar_ Jalisco
140220009,Emiliano Zapata (El Ranchito)_ Cihuatlán_ Jalisco
140970043,Buenavista_ Tlajomulco de Zúñiga_ Jalisco
140530927,Cristeros [Fraccionamiento]_ Lagos de Moreno_ Jalisco
140970009,El Capulín_ Tlajomulco de Zúñiga_ Jalisco
140200037,Las Juntas y los Veranos_ Cabo Corrientes_ Jalisco
140430123,Juan Gil Preciado_ La Huerta_ Jalisco
140310001,Chimaltitán_ Chimaltitán_ Jalisco
140130145,Vistas del Maguey [Fraccionamiento]_ Atotonilco el Alto_ Jalisco
140670009,Boca de Tomatlán_ Puerto Vallarta_ Jalisco
140970104,Miguel Hidalgo [Aeropuerto Internacional]_ Tlajomulco de Zúñiga_ Jalisco
140970777,Rancho Alegre [Fraccionamiento]_ Tlajomulco de Zúñiga_ Jalisco
140700064,La Alameda [Fraccionamiento]_ El Salto_ Jalisco
141010027,La Punta_ Tonalá_ Jalisco
140970177,Potrero Zapote del Valle (El Ahogado)_ Tlajomulco de Zúñiga_ Jalisco
140110001,Atengo_ Atengo_ Jalisco
141010190,Paseo Puente Viejo_ Tonalá_ Jalisco
140320001,Chiquilistlán_ Chiquilistlán_ Jalisco
141200206,San Esteban (San Miguel Tateposco)_ Zapopan_ Jalisco
