codigo_loc_completa,loc_completa
230080308,Puerto Aventuras_ Solidaridad_ Quintana Roo
230070012,Holbox_ Lázaro Cárdenas_ Quintana Roo
230110193,Leona Vicario_ Puerto Morelos_ Quintana Roo
230020250,Tihosuco_ Felipe Carrillo Puerto_ Quintana Roo
230060069,José María Morelos_ José María Morelos_ Quintana Roo
230020239,Señor_ Felipe Carrillo Puerto_ Quintana Roo
230040123,Javier Rojo Gómez_ Othón P. Blanco_ Quintana Roo
230100177,Limones_ Bacalar_ Quintana Roo
230070001,Kantunilkín_ Lázaro Cárdenas_ Quintana Roo
230040840,Parque Industrial_ Othón P. Blanco_ Quintana Roo
230040064,Nicolás Bravo_ Othón P. Blanco_ Quintana Roo
230030286,Zona Urbana Ejido Isla Mujeres_ Isla Mujeres_ Quintana Roo
230040016,Calderitas_ Othón P. Blanco_ Quintana Roo
230110049,Delta Premezclados_ Puerto Morelos_ Quintana Roo
230020044,Chunhuhub_ Felipe Carrillo Puerto_ Quintana Roo
230090067,Crucero de las Ruinas de Tulum_ Tulum_ Quintana Roo
230040201,Sergio Butrón Casas_ Othón P. Blanco_ Quintana Roo
230020248,Tepich_ Felipe Carrillo Puerto_ Quintana Roo
240280001,San Luis Potosí_ San Luis Potosí_ San Luis Potosí
240200001,Matehuala_ Matehuala_ San Luis Potosí
240130001,Ciudad Valles_ Ciudad Valles_ San Luis Potosí
240550001,Villa de Zaragoza_ Zaragoza_ San Luis Potosí
240400001,Tamuín_ Tamuín_ San Luis Potosí
240370001,Tamazunchale_ Tamazunchale_ San Luis Potosí
240160001,Ebano_ Ebano_ San Luis Potosí
240230001,Rayón_ Rayón_ San Luis Potosí
240150001,Charcas_ Charcas_ San Luis Potosí
240360064,Tambaca_ Tamasopo_ San Luis Potosí
240080001,Cerritos_ Cerritos_ San Luis Potosí
240450001,Venado_ Venado_ San Luis Potosí
240250001,Salinas de Hidalgo_ Salinas_ San Luis Potosí
240120001,Tancanhuitz_ Tancanhuitz_ San Luis Potosí
240320001,Santa María del Río_ Santa María del Río_ San Luis Potosí
240500001,Villa de Reyes_ Villa de Reyes_ San Luis Potosí
240240001,Rioverde_ Rioverde_ San Luis Potosí
240350001,Soledad de Graciano Sánchez_ Soledad de Graciano Sánchez_ San Luis Potosí
240100001,Ciudad del Maíz_ Ciudad del Maíz_ San Luis Potosí
240520001,Villa Juárez_ Villa Juárez_ San Luis Potosí
240070001,Cedral_ Cedral_ San Luis Potosí
240510001,Villa Hidalgo_ Villa Hidalgo_ San Luis Potosí
240420001,Tanquián de Escobedo_ Tanquián de Escobedo_ San Luis Potosí
240130562,Ampliación la Hincada_ Ciudad Valles_ San Luis Potosí
240160005,Pujal Coy_ Ebano_ San Luis Potosí
240050001,Cárdenas_ Cárdenas_ San Luis Potosí
240460001,Villa de Arriaga_ Villa de Arriaga_ San Luis Potosí
240530001,Axtla de Terrazas_ Axtla de Terrazas_ San Luis Potosí
240360001,Tamasopo_ Tamasopo_ San Luis Potosí
240370033,Chapulhuacanito_ Tamazunchale_ San Luis Potosí
240560002,Villa de Arista_ Villa de Arista_ San Luis Potosí
240340001,San Vicente Tancuayalab_ San Vicente Tancuayalab_ San Luis Potosí
240570001,Matlapa_ Matlapa_ San Luis Potosí
240210041,La Loma_ Mexquitic de Carmona_ San Luis Potosí
240580001,El Naranjo_ El Naranjo_ San Luis Potosí
240110001,Ciudad Fernández_ Ciudad Fernández_ San Luis Potosí
240270001,San Ciro de Acosta_ San Ciro de Acosta_ San Luis Potosí
240530031,Jalpilla_ Axtla de Terrazas_ San Luis Potosí
240060001,Real de Catorce_ Catorce_ San Luis Potosí
240220001,Moctezuma_ Moctezuma_ San Luis Potosí
240430001,Tierra Nueva_ Tierra Nueva_ San Luis Potosí
240540001,Xilitla_ Xilitla_ San Luis Potosí
240260001,San Antonio_ San Antonio_ San Luis Potosí
240490012,Dulce Grande_ Villa de Ramos_ San Luis Potosí
240490005,El Barril_ Villa de Ramos_ San Luis Potosí
240490001,Villa de Ramos_ Villa de Ramos_ San Luis Potosí
240490043,El Zacatón_ Villa de Ramos_ San Luis Potosí
240380001,Tampacán_ Tampacán_ San Luis Potosí
240290001,San Martín Chalchicuautla_ San Martín Chalchicuautla_ San Luis Potosí
240100065,Palomas_ Ciudad del Maíz_ San Luis Potosí
240210001,Mexquitic de Carmona_ Mexquitic de Carmona_ San Luis Potosí
240160091,Ponciano Arriaga_ Ebano_ San Luis Potosí
240410001,Tanlajás_ Tanlajás_ San Luis Potosí
240350026,Rancho Nuevo_ Soledad de Graciano Sánchez_ San Luis Potosí
240130162,Rascón_ Ciudad Valles_ San Luis Potosí
240390001,Tampamolón Corona_ Tampamolón Corona_ San Luis Potosí
240280264,La Pila_ San Luis Potosí_ San Luis Potosí
240440001,Vanegas_ Vanegas_ San Luis Potosí
240030001,Aquismón_ Aquismón_ San Luis Potosí
240400157,Nuevo Tampaón_ Tamuín_ San Luis Potosí
240140001,Coxcatlán_ Coxcatlán_ San Luis Potosí
240280252,Escalerillas_ San Luis Potosí_ San Luis Potosí
240010001,Ahualulco del Sonido 13_ Ahualulco_ San Luis Potosí
240300001,San Nicolás Tolentino_ San Nicolás Tolentino_ San Luis Potosí
240490018,Hernández_ Villa de Ramos_ San Luis Potosí
240330001,Santo Domingo_ Santo Domingo_ San Luis Potosí
240170001,Guadalcázar_ Guadalcázar_ San Luis Potosí
240570010,Chalchocoyo_ Matlapa_ San Luis Potosí
240180001,Huehuetlán_ Huehuetlán_ San Luis Potosí
240400086,Las Palmas_ Tamuín_ San Luis Potosí
240280239,Laguna de Santa Rita_ San Luis Potosí_ San Luis Potosí
240360003,Agua Buena_ Tamasopo_ San Luis Potosí
240480001,Villa de la Paz_ Villa de la Paz_ San Luis Potosí
250120001,Mazatlán_ Mazatlán_ Sinaloa
250150001,Guamúchil_ Salvador Alvarado_ Sinaloa
250060341,Eldorado_ Culiacán_ Sinaloa
250061346,El Diez_ Culiacán_ Sinaloa
250170001,Sinaloa de Leyva_ Sinaloa_ Sinaloa
250050001,Cosalá_ Cosalá_ Sinaloa
250160001,San Ignacio_ San Ignacio_ Sinaloa
250110001,Guasave_ Guasave_ Sinaloa
250090001,Escuinapa de Hidalgo_ Escuinapa_ Sinaloa
250060591,Quilá_ Culiacán_ Sinaloa
250110051,Estación Bamoa (Campo Wilson)_ Guasave_ Sinaloa
250010083,Bagojo Colectivo_ Ahome_ Sinaloa
250010227,San Miguel Zapotitlán_ Ahome_ Sinaloa
250070001,Choix_ Choix_ Sinaloa
250100102,Adolfo López Mateos (Jahuara Segundo)_ El Fuerte_ Sinaloa
250180001,Navolato_ Navolato_ Sinaloa
250110035,Adolfo Ruiz Cortines_ Guasave_ Sinaloa
250020031,Colonia Independencia (Chinitos)_ Angostura_ Sinaloa
250010120,Compuertas_ Ahome_ Sinaloa
250060443,El Limón de los Ramos_ Culiacán_ Sinaloa
250020001,Angostura_ Angostura_ Sinaloa
250020007,Alhuey_ Angostura_ Sinaloa
250060312,Costa Rica_ Culiacán_ Sinaloa
250100133,Mochicahui_ El Fuerte_ Sinaloa
250060889,Ejido el Quince (El Quincito)_ Culiacán_ Sinaloa
250120348,Villa Unión_ Mazatlán_ Sinaloa
250170495,Estación Naranjo_ Sinaloa_ Sinaloa
250080001,La Cruz_ Elota_ Sinaloa
250010703,Cinco de Mayo_ Ahome_ Sinaloa
250110138,Juan José Ríos_ Guasave_ Sinaloa
250130001,Mocorito_ Mocorito_ Sinaloa
250060400,La Higuerita (Las Higueras de Culiacán)_ Culiacán_ Sinaloa
250110093,Corerepe (El Gallo)_ Guasave_ Sinaloa
250060438,Leopoldo Sánchez Celis_ Culiacán_ Sinaloa
250140388,Agua Verde_ Rosario_ Sinaloa
250040100,Mesillas_ Concordia_ Sinaloa
250090034,Isla del Bosque_ Escuinapa_ Sinaloa
250110132,Gabriel Leyva Solano (Benito Juárez)_ Guasave_ Sinaloa
250010119,El Colorado_ Ahome_ Sinaloa
250010189,Ejido 9 de Diciembre_ Ahome_ Sinaloa
250110065,El Cerro Cabezón_ Guasave_ Sinaloa
250100058,Constancia_ El Fuerte_ Sinaloa
250020032,Colonia Agrícola México (Palmitas)_ Angostura_ Sinaloa
250110070,Callejones de Guasavito_ Guasave_ Sinaloa
250180145,Ejido Convención de Aguascalientes_ Navolato_ Sinaloa
250090043,Ojo de Agua de Palmillas_ Escuinapa_ Sinaloa
250010183,Mochis (Ejido Mochis)_ Ahome_ Sinaloa
250110064,El Burrión_ Guasave_ Sinaloa
250110191,Las Parritas_ Guasave_ Sinaloa
250130235,Pericos_ Mocorito_ Sinaloa
250061360,Estación Obispo_ Culiacán_ Sinaloa
250100001,El Fuerte_ El Fuerte_ Sinaloa
250010240,Topolobampo_ Ahome_ Sinaloa
250040001,Heroica Ciudad Concordia_ Concordia_ Sinaloa
250100179,San Blas_ El Fuerte_ Sinaloa
250010070,Ahome_ Ahome_ Sinaloa
250060746,Adolfo López Mateos (El Tamarindo)_ Culiacán_ Sinaloa
250060321,Culiacancito_ Culiacán_ Sinaloa
250062073,Ejido Canán_ Culiacán_ Sinaloa
250180374,Licenciado Benito Juárez (Campo Gobierno)_ Navolato_ Sinaloa
250030001,Badiraguato_ Badiraguato_ Sinaloa
250140001,El Rosario_ Rosario_ Sinaloa
250090060,Teacapán_ Escuinapa_ Sinaloa
250180019,El Batallón_ Navolato_ Sinaloa
250160066,Dimas (Estación Dimas)_ San Ignacio_ Sinaloa
250110269,Tamazula_ Guasave_ Sinaloa
250010801,Campo la Arrocera_ Ahome_ Sinaloa
250010160,Higuera de Zaragoza_ Ahome_ Sinaloa
250010115,Cerrillos (Campo 35)_ Ahome_ Sinaloa
250180091,General Ángel Flores (La Palma)_ Navolato_ Sinaloa
250010156,Gustavo Díaz Ordaz (El Carrizo)_ Ahome_ Sinaloa
250010215,Ejido Ricardo Flores Magón_ Ahome_ Sinaloa
250110049,Bachoco_ Guasave_ Sinaloa
250150040,Benito Juárez_ Salvador Alvarado_ Sinaloa
250121257,Fraccionamiento los Ángeles_ Mazatlán_ Sinaloa
250010197,Plan de Ayala [Campo Cinco]_ Ahome_ Sinaloa
250010088,Ejido Benito Juárez_ Ahome_ Sinaloa
250110282,La Trinidad_ Guasave_ Sinaloa
250110283,Los Ángeles_ Guasave_ Sinaloa
250100069,Charay_ El Fuerte_ Sinaloa
250180355,San Pedro_ Navolato_ Sinaloa
250180041,El Castillo_ Navolato_ Sinaloa
250062099,Campo Cuba_ Culiacán_ Sinaloa
250110816,Ranchito de Inzunza_ Guasave_ Sinaloa
250060556,El Pinole_ Culiacán_ Sinaloa
250110125,La Escalera_ Guasave_ Sinaloa
250010126,Chihuahuita_ Ahome_ Sinaloa
250110759,San José de Guayparime_ Guasave_ Sinaloa
250010205,Primero de Mayo_ Ahome_ Sinaloa
250020093,La Reforma_ Angostura_ Sinaloa
250060888,La Pedrera_ Culiacán_ Sinaloa
250120304,El Roble_ Mazatlán_ Sinaloa
250110161,León Fonseca (Estación Verdura)_ Guasave_ Sinaloa
250110102,El Cubilete (El Cubilete Número Uno)_ Guasave_ Sinaloa
250110148,El Huitussi_ Guasave_ Sinaloa
250061194,Pueblos Unidos_ Culiacán_ Sinaloa
250060933,Ejido el Quemadito_ Culiacán_ Sinaloa
250062518,El Ranchito_ Culiacán_ Sinaloa
250110052,Bamoa_ Guasave_ Sinaloa
250180006,Altata_ Navolato_ Sinaloa
250060890,Argentina Dos_ Culiacán_ Sinaloa
250180065,Juan Aldama (El Tigre)_ Navolato_ Sinaloa
250120761,El Walamo_ Mazatlán_ Sinaloa
250110358,Ladrilleras de Ocoro_ Guasave_ Sinaloa
250063141,Bachigualatito_ Culiacán_ Sinaloa
250180045,Cofradía de Navolato (Cofradía de los Rocha)_ Navolato_ Sinaloa
250100193,Los Taxtes_ El Fuerte_ Sinaloa
250180230,Cofradía de San Pedro (Cofradía de la Estancia)_ Navolato_ Sinaloa
250010118,Cohuibampo_ Ahome_ Sinaloa
250010193,Ejido Ohuira_ Ahome_ Sinaloa
250010174,Ejido Louisiana_ Ahome_ Sinaloa
250061152,Campo la Flor II_ Culiacán_ Sinaloa
250060612,Estación Rosales_ Culiacán_ Sinaloa
250010818,Nuevo San Miguel_ Ahome_ Sinaloa
260300001,Hermosillo_ Hermosillo_ Sonora
260360001,Magdalena de Kino_ Magdalena_ Sonora
260430001,Heroica Nogales_ Nogales_ Sonora
260420001,Navojoa_ Navojoa_ Sonora
260180001,Ciudad Obregón_ Cajeme_ Sonora
260550001,San Luis Río Colorado_ San Luis Río Colorado_ Sonora
260480001,Puerto Peñasco_ Puerto Peñasco_ Sonora
260020001,Agua Prieta_ Agua Prieta_ Sonora
260170001,Heroica Caborca_ Caborca_ Sonora
260250001,Empalme_ Empalme_ Sonora
260040001,Altar_ Altar_ Sonora
260550017,Ingeniero Luis B. Sánchez_ San Luis Río Colorado_ Sonora
260390001,Naco_ Naco_ Sonora
260720001,San Ignacio Río Muerto_ San Ignacio Río Muerto_ Sonora
260290325,Vícam (Switch)_ Guaymas_ Sonora
260660001,Heroica Ciudad de Ures_ Ures_ Sonora
260270045,Esqueda_ Fronteras_ Sonora
260300343,Miguel Alemán (La Doce)_ Hermosillo_ Sonora
260190001,Heroica Ciudad de Cananea_ Cananea_ Sonora
260170246,Plutarco Elías Calles (La Y Griega)_ Caborca_ Sonora
260580001,Santa Ana_ Santa Ana_ Sonora
260350001,Imuris_ Imuris_ Sonora
260600001,Sáric_ Sáric_ Sonora
260470001,Pitiquito_ Pitiquito_ Sonora
260180403,Pueblo Yaqui_ Cajeme_ Sonora
260120001,Bácum_ Bácum_ Sonora
260180334,Marte R. Gómez (Tobarito)_ Cajeme_ Sonora
260290202,Pótam_ Guaymas_ Sonora
260180284,Cócorit_ Cajeme_ Sonora
260710001,Villa Juárez_ Benito Juárez_ Sonora
260180364,Providencia_ Cajeme_ Sonora
260090001,Bacanora_ Bacanora_ Sonora
260300535,San Pedro o el Saucito (San Pedro el Saucito)_ Hermosillo_ Sonora
260700001,Sonoyta_ General Plutarco Elías Calles_ Sonora
260330001,Huatabampo_ Huatabampo_ Sonora
260300137,Bahía de Kino_ Hermosillo_ Sonora
260690001,Yécora_ Yécora_ Sonora
260260001,Etchojoa_ Etchojoa_ Sonora
260510001,Rosario_ Rosario_ Sonora
260370001,Mazatán_ Mazatán_ Sonora
260120093,San José de Bácum_ Bácum_ Sonora
260330002,Agiabampo Uno_ Huatabampo_ Sonora
260260011,Bacobampo_ Etchojoa_ Sonora
260180093,Cuauhtémoc (Campo Cinco)_ Cajeme_ Sonora
260380001,Moctezuma_ Moctezuma_ Sonora
260060001,Arizpe_ Arizpe_ Sonora
260260008,Bacame Nuevo_ Etchojoa_ Sonora
260230001,Cumpas_ Cumpas_ Sonora
260550011,Golfo de Santa Clara_ San Luis Río Colorado_ Sonora
260410001,Nacozari de García_ Nacozari de García_ Sonora
260290025,San Carlos (San Carlos Nuevo Guaymas)_ Guaymas_ Sonora
260210001,La Colorada_ La Colorada_ Sonora
260120082,Francisco Javier Mina (Campo 60)_ Bácum_ Sonora
260480004,Bahía la Choya_ Puerto Peñasco_ Sonora
260470065,Puerto Libertad_ Pitiquito_ Sonora
260160001,Benjamín Hill_ Benjamín Hill_ Sonora
260230012,Los Hoyos_ Cumpas_ Sonora
260520001,Sahuaripa_ Sahuaripa_ Sonora
260330107,10 de Abril_ Huatabampo_ Sonora
260260012,Basconcobe_ Etchojoa_ Sonora
260260019,Buaysiacobe_ Etchojoa_ Sonora
260400001,Nácori Chico_ Nácori Chico_ Sonora
260660076,San Pedro de Ures (San Pedro)_ Ures_ Sonora
260180365,Quetchehueca_ Cajeme_ Sonora
260200001,Carbó_ Carbó_ Sonora
260630001,Tepache_ Tepache_ Sonora
260140001,Baviácora_ Baviácora_ Sonora
260010001,Aconchi_ Aconchi_ Sonora
260560027,Pesqueira_ San Miguel de Horcasitas_ Sonora
260320001,Huásabas_ Huásabas_ Sonora
260100001,Bacerac_ Bacerac_ Sonora
260560001,San Miguel de Horcasitas_ San Miguel de Horcasitas_ Sonora
260110001,Bacoachi_ Bacoachi_ Sonora
260150001,Bavispe_ Bavispe_ Sonora
260050001,Arivechi_ Arivechi_ Sonora
260330017,Las Bocas_ Huatabampo_ Sonora
260180289,Estación Corral_ Cajeme_ Sonora
260640001,Trincheras_ Trincheras_ Sonora
260130001,Banámichi_ Banámichi_ Sonora
260450068,Querobabi_ Opodepe_ Sonora
260330099,Yavaros (Isla las Viejas)_ Huatabampo_ Sonora
260270001,Fronteras_ Fronteras_ Sonora
260330094,La Unión_ Huatabampo_ Sonora
260720017,Bahía de Lobos_ San Ignacio Río Muerto_ Sonora
270040001,Villahermosa_ Centro_ Tabasco
270170001,Tenosique de Pino Suárez_ Tenosique_ Tabasco
270040160,Río Viejo 1ra. Sección_ Centro_ Tabasco
270020001,Cárdenas_ Cárdenas_ Tabasco
270050058,Reyes Hernández 2da. Sección_ Comalcalco_ Tabasco
270040123,Luis Gil Pérez_ Centro_ Tabasco
270010001,Balancán_ Balancán_ Tabasco
270120039,La Curva_ Macuspana_ Tabasco
270130016,Libertad_ Nacajuca_ Tabasco
270020117,Poblado C-22 Licenciado José María Pino Suárez_ Cárdenas_ Tabasco
270020073,Poblado C-27 Ingeniero Eduardo Chávez Ramírez_ Cárdenas_ Tabasco
270040146,Guapinol_ Centro_ Tabasco
270160001,Teapa_ Teapa_ Tabasco
270080001,Huimanguillo_ Huimanguillo_ Tabasco
270060007,Carlos Rovirosa (Tulipán)_ Cunduacán_ Tabasco
270030001,Frontera_ Centla_ Tabasco
270010074,El Triunfo_ Balancán_ Tabasco
270070001,Emiliano Zapata_ Emiliano Zapata_ Tabasco
270040206,La Lima_ Centro_ Tabasco
270120016,Belén_ Macuspana_ Tabasco
270130001,Nacajuca_ Nacajuca_ Tabasco
270040264,Parrilla II_ Centro_ Tabasco
270040065,Buena Vista Río Nuevo 1ra. Sección_ Centro_ Tabasco
270040034,Anacleto Canabal 2da. Sección_ Centro_ Tabasco
270020004,Poblado C-15 Adolfo López Mateos_ Cárdenas_ Tabasco
270120018,Benito Juárez (San Carlos)_ Macuspana_ Tabasco
270020082,Santa Rosalía (Miguel Hidalgo 2da. Sección)_ Cárdenas_ Tabasco
270050001,Comalcalco_ Comalcalco_ Tabasco
270050042,Miguel Hidalgo_ Comalcalco_ Tabasco
270130088,Pomoca_ Nacajuca_ Tabasco
270130069,La Selva_ Nacajuca_ Tabasco
270120091,Pemex (Ciudad Pemex)_ Macuspana_ Tabasco
270020090,Poblado C-29 General Vicente Guerrero_ Cárdenas_ Tabasco
270020029,Benito Juárez (Campo Magallanes)_ Cárdenas_ Tabasco
270040061,Buena Vista 1ra. Sección_ Centro_ Tabasco
270140001,Paraíso_ Paraíso_ Tabasco
270040214,Ocuiltzapotlán_ Centro_ Tabasco
270150001,Tacotalpa_ Tacotalpa_ Tabasco
270030061,Vicente Guerrero_ Centla_ Tabasco
270040176,Macultepec_ Centro_ Tabasco
270040166,Playas del Rosario (Subteniente García)_ Centro_ Tabasco
270040183,Tamulté de las Sabanas_ Centro_ Tabasco
270110001,Jonuta_ Jonuta_ Tabasco
270130062,Bosque de Saloya_ Nacajuca_ Tabasco
270040033,Anacleto Canabal 1ra. Sección_ Centro_ Tabasco
270020034,Poblado C-10 General Lázaro Cárdenas del Río_ Cárdenas_ Tabasco
270020030,Poblado C-09 Licenciado Francisco I. Madero_ Cárdenas_ Tabasco
270080016,Chontalpa (Estación Chontalpa)_ Huimanguillo_ Tabasco
270020003,Poblado C-11 José María Morelos y Pavón_ Cárdenas_ Tabasco
270050002,Aldama_ Comalcalco_ Tabasco
270120011,Aquiles Serdán (San Fernando)_ Macuspana_ Tabasco
270100019,Iquinuapa_ Jalpa de Méndez_ Tabasco
270050012,Carlos Greene_ Comalcalco_ Tabasco
270060028,Huimango_ Cunduacán_ Tabasco
270080098,La Venta_ Huimanguillo_ Tabasco
270040145,Parrilla_ Centro_ Tabasco
270040111,Ixtacomitán 1ra. Sección_ Centro_ Tabasco
270040087,Emiliano Zapata_ Centro_ Tabasco
270020051,Melchor Ocampo_ Cárdenas_ Tabasco
270060016,Cucuyulapa_ Cunduacán_ Tabasco
270020025,Poblado C-16 General Emiliano Zapata_ Cárdenas_ Tabasco
270040062,Buena Vista 2da. Sección_ Centro_ Tabasco
270050066,Tecolutilla_ Comalcalco_ Tabasco
270040134,Medellín y Pigua 3ra. Sección_ Centro_ Tabasco
270140010,Las Flores 2da. Sección_ Paraíso_ Tabasco
270090001,Jalapa_ Jalapa_ Tabasco
270030056,Simón Sarlat_ Centla_ Tabasco
270020087,Poblado C-33 20 de Noviembre_ Cárdenas_ Tabasco
270130013,Guatacalca_ Nacajuca_ Tabasco
270070009,Chablé_ Emiliano Zapata_ Tabasco
270060032,Libertad_ Cunduacán_ Tabasco
270020096,Poblado C-20 Miguel Hidalgo y Costilla_ Cárdenas_ Tabasco
270130017,Lomitas_ Nacajuca_ Tabasco
270030035,Ignacio Allende_ Centla_ Tabasco
270020022,Coronel Andrés Sánchez Magallanes_ Cárdenas_ Tabasco
270050020,Chichicapa_ Comalcalco_ Tabasco
270020013,Azucena 2da. Sección_ Cárdenas_ Tabasco
270080109,C-34 (Licenciado Benito Juárez García)_ Huimanguillo_ Tabasco
270040251,Fraccionamiento Ocuiltzapotlán Dos_ Centro_ Tabasco
270030015,Cuauhtémoc_ Centla_ Tabasco
270150060,Tapijulapa_ Tacotalpa_ Tabasco
270020024,Poblado C-28 Coronel Gregorio Méndez Magaña_ Cárdenas_ Tabasco
270100003,Ayapa_ Jalpa de Méndez_ Tabasco
270100021,Jalupa_ Jalpa de Méndez_ Tabasco
270050016,Cocohital_ Comalcalco_ Tabasco
270060044,Once de Febrero 1ra. Sección_ Cunduacán_ Tabasco
270060005,Buenaventura_ Cunduacán_ Tabasco
270020097,Ingenio Presidente Benito Juárez_ Cárdenas_ Tabasco
270140006,Puerto Ceiba_ Paraíso_ Tabasco
270100036,Soyataco_ Jalpa de Méndez_ Tabasco
270080107,C-31 (General Francisco Villa)_ Huimanguillo_ Tabasco
270080111,C-41 (Licenciado Carlos A. Madrazo)_ Huimanguillo_ Tabasco
270140027,Quintín Arauz_ Paraíso_ Tabasco
270060057,Río Seco 2da. Sección (Santiaguito)_ Cunduacán_ Tabasco
270080110,C-40 (Ernesto Aguirre Colorado)_ Huimanguillo_ Tabasco
270040258,Constitución_ Centro_ Tabasco
280030001,Altamira_ Altamira_ Tamaulipas
280250001,Ciudad Miguel Alemán_ Miguel Alemán_ Tamaulipas
280240001,Mier_ Mier_ Tamaulipas
280270001,Nuevo Laredo_ Nuevo Laredo_ Tamaulipas
280220001,Heroica Matamoros_ Matamoros_ Tamaulipas
280380001,Tampico_ Tampico_ Tamaulipas
280090001,Ciudad Madero_ Ciudad Madero_ Tamaulipas
280410001,Ciudad Victoria_ Victoria_ Tamaulipas
280400001,Valle Hermoso_ Valle Hermoso_ Tamaulipas
280200001,Villa Mainero_ Mainero_ Tamaulipas
280150001,Ciudad Gustavo Díaz Ordaz_ Gustavo Díaz Ordaz_ Tamaulipas
280210001,Ciudad Mante_ El Mante_ Tamaulipas
280390001,Ciudad Tula_ Tula_ Tamaulipas
280370001,Soto la Marina_ Soto la Marina_ Tamaulipas
280030122,Miramar_ Altamira_ Tamaulipas
280430001,Xicoténcatl_ Xicoténcatl_ Tamaulipas
280010001,Abasolo_ Abasolo_ Tamaulipas
280250015,Los Guerra_ Miguel Alemán_ Tamaulipas
280170001,Jaumave_ Jaumave_ Tamaulipas
280290001,Ocampo_ Ocampo_ Tamaulipas
280160001,Hidalgo_ Hidalgo_ Tamaulipas
280120001,González_ González_ Tamaulipas
280040001,Antiguo Morelos_ Antiguo Morelos_ Tamaulipas
280070001,Ciudad Camargo_ Camargo_ Tamaulipas
280350001,San Fernando_ San Fernando_ Tamaulipas
280420001,Villagrán_ Villagrán_ Tamaulipas
280300001,Nueva Villa de Padilla_ Padilla_ Tamaulipas
280400004,Anáhuac_ Valle Hermoso_ Tamaulipas
280330291,Nuevo Progreso_ Río Bravo_ Tamaulipas
280220264,Ramírez_ Matamoros_ Tamaulipas
280400067,El Realito_ Valle Hermoso_ Tamaulipas
280340001,San Carlos_ San Carlos_ Tamaulipas
280300009,Barretal_ Padilla_ Tamaulipas
280180001,Santander Jiménez_ Jiménez_ Tamaulipas
280350139,General Francisco Villa_ San Fernando_ Tamaulipas
280120061,Graciano Sánchez_ González_ Tamaulipas
280190001,Llera de Canales_ Llera_ Tamaulipas
280130001,Güémez_ Güémez_ Tamaulipas
280280001,Nuevo Morelos_ Nuevo Morelos_ Tamaulipas
280030043,Cuauhtémoc_ Altamira_ Tamaulipas
280150016,Valadeces_ Gustavo Díaz Ordaz_ Tamaulipas
280110001,Loma Alta (Loma Alta de Gómez Farías)_ Gómez Farías_ Tamaulipas
280070016,Comales_ Camargo_ Tamaulipas
280210073,El Limón_ El Mante_ Tamaulipas
280220104,El Control_ Matamoros_ Tamaulipas
280100001,Cruillas_ Cruillas_ Tamaulipas
280140001,Nueva Ciudad Guerrero_ Guerrero_ Tamaulipas
280160145,Estación Santa Engracia_ Hidalgo_ Tamaulipas
280350542,Carboneras (La Carbonera)_ San Fernando_ Tamaulipas
280050001,Burgos_ Burgos_ Tamaulipas
280230001,Méndez_ Méndez_ Tamaulipas
280060001,Bustamante_ Bustamante_ Tamaulipas
280010111,Guadalupe Victoria_ Abasolo_ Tamaulipas
280270162,El Campanario y Oradel_ Nuevo Laredo_ Tamaulipas
280110036,Gómez Farías_ Gómez Farías_ Tamaulipas
290010001,Amaxac de Guerrero_ Amaxac de Guerrero_ Tlaxcala
290020005,Tlatempan_ Apetatitlán de Antonio Carvajal_ Tlaxcala
290020001,Apetatitlán_ Apetatitlán de Antonio Carvajal_ Tlaxcala
290050001,Ciudad de Apizaco_ Apizaco_ Tlaxcala
290550001,San Lucas Tecopilco_ San Lucas Tecopilco_ Tlaxcala
290060001,Heroica Ciudad de Calpulalpan_ Calpulalpan_ Tlaxcala
290430007,Santa Úrsula Zimatepec_ Yauhquemehcan_ Tlaxcala
290140001,Hueyotlipan_ Hueyotlipan_ Tlaxcala
290440001,Zacatelco_ Zacatelco_ Tlaxcala
290040001,Atlzayanca_ Atltzayanca_ Tlaxcala
290380002,San Andrés Ahuashuatepec_ Tzompantepec_ Tlaxcala
290020002,Belén Atzitzimititlán_ Apetatitlán de Antonio Carvajal_ Tlaxcala
290100001,Santa Ana Chiautempan_ Chiautempan_ Tlaxcala
290330001,Tlaxcala de Xicohténcatl_ Tlaxcala_ Tlaxcala
290330015,San Sebastián Atlahapa_ Tlaxcala_ Tlaxcala
290600001,Santa Isabel Xiloxoxtla_ Santa Isabel Xiloxoxtla_ Tlaxcala
290180001,Contla_ Contla de Juan Cuamatzi_ Tlaxcala
290080001,Cuapiaxtla_ Cuapiaxtla_ Tlaxcala
290050010,Santa María Texcalac_ Apizaco_ Tlaxcala
290270001,Tenancingo_ Tenancingo_ Tlaxcala
290330016,Santa María Acuitlapilco_ Tlaxcala_ Tlaxcala
290050007,San Luis Apizaquito_ Apizaco_ Tlaxcala
290470001,Lázaro Cárdenas_ Lázaro Cárdenas_ Tlaxcala
290480001,La Magdalena Tlaltelulco_ La Magdalena Tlaltelulco_ Tlaxcala
290150001,Villa Mariano Matamoros_ Ixtacuixtla de Mariano Matamoros_ Tlaxcala
290070001,Villa de El Carmen Tequexquitla_ El Carmen Tequexquitla_ Tlaxcala
290150003,San Antonio Atotonilco_ Ixtacuixtla de Mariano Matamoros_ Tlaxcala
290330017,Santa María Ixtulco_ Tlaxcala_ Tlaxcala
290520001,San José Teacalco_ San José Teacalco_ Tlaxcala
290310011,San Francisco Atexcatzinco_ Tetla de la Solidaridad_ Tlaxcala
290320007,Santa Cruz Aquiahuac_ Tetlatlahuca_ Tlaxcala
290280001,Teolocholco_ Teolocholco_ Tlaxcala
290110001,Muñoz_ Muñoz de Domingo Arenas_ Tlaxcala
290330011,San Esteban Tizatlán_ Tlaxcala_ Tlaxcala
290210001,Ciudad de Nanacamilpa_ Nanacamilpa de Mariano Arista_ Tlaxcala
290330008,Ocotlán_ Tlaxcala_ Tlaxcala
290170001,Mazatecochco_ Mazatecochco de José María Morelos_ Tlaxcala
290420001,Xicohtzinco_ Xicohtzinco_ Tlaxcala
290360001,San Juan Totolac_ Totolac_ Tlaxcala
290090001,Cuaxomulco_ Cuaxomulco_ Tlaxcala
290410001,Papalotla_ Papalotla de Xicohténcatl_ Tlaxcala
290190007,San Mateo Ayecac_ Tepetitla de Lardizábal_ Tlaxcala
290260005,San Miguel Contla_ Santa Cruz Tlaxcala_ Tlaxcala
290410004,San Marcos Contla_ Papalotla de Xicohténcatl_ Tlaxcala
290290001,Tepeyanco_ Tepeyanco_ Tlaxcala
290230001,Natívitas_ Natívitas_ Tlaxcala
290580001,Santa Catarina Ayometla_ Santa Catarina Ayometla_ Tlaxcala
290590001,Santa Cruz Quilehtla_ Santa Cruz Quilehtla_ Tlaxcala
290530001,San Juan Huactzinco_ San Juan Huactzinco_ Tlaxcala
290320001,Tetlatlahuca_ Tetlatlahuca_ Tlaxcala
290250002,San Isidro Buen Suceso_ San Pablo del Monte_ Tlaxcala
290190001,Tepetitla_ Tepetitla de Lardizábal_ Tlaxcala
290510001,San Jerónimo Zacualpan_ San Jerónimo Zacualpan_ Tlaxcala
290330009,San Buenaventura Atempan_ Tlaxcala_ Tlaxcala
290390006,Colonia Venustiano Carranza_ Xaloztoc_ Tlaxcala
290330012,San Gabriel Cuauhtla_ Tlaxcala_ Tlaxcala
290230004,Santo Tomás la Concordia_ Natívitas_ Tlaxcala
290100010,Santa Cruz Tetela_ Chiautempan_ Tlaxcala
290160001,Ixtenco_ Ixtenco_ Tlaxcala
290560001,Santa Ana Nopalucan_ Santa Ana Nopalucan_ Tlaxcala
290330010,San Diego Metepec_ Tlaxcala_ Tlaxcala
290500001,San Francisco Tetlanohcan_ San Francisco Tetlanohcan_ Tlaxcala
290130016,Ignacio Zaragoza_ Huamantla_ Tlaxcala
290230017,San Vicente Xiloxochitla_ Natívitas_ Tlaxcala
290390007,Santa Cruz Zacatzontetla_ Xaloztoc_ Tlaxcala
290340001,Tlaxco_ Tlaxco_ Tlaxcala
290370001,Zitlaltépec_ Ziltlaltépec de Trinidad Sánchez Santos_ Tlaxcala
290260002,Guadalupe Tlachco_ Santa Cruz Tlaxcala_ Tlaxcala
290310010,San Bartolomé Matlalohcan_ Tetla de la Solidaridad_ Tlaxcala
290260001,Santa Cruz Tlaxcala_ Santa Cruz Tlaxcala_ Tlaxcala
290390002,San Pedro Tlacotepec_ Xaloztoc_ Tlaxcala
290300001,Terrenate_ Terrenate_ Tlaxcala
290450001,Benito Juárez_ Benito Juárez_ Tlaxcala
290540001,San Lorenzo Axocomanitla_ San Lorenzo Axocomanitla_ Tlaxcala
290380001,Tzompantepec_ Tzompantepec_ Tlaxcala
290050006,Colonia San Isidro_ Apizaco_ Tlaxcala
290310001,Tetla_ Tetla de la Solidaridad_ Tlaxcala
