codigo_loc_completa,loc_completa
160690001,La Piedad de Cabadas_ La Piedad_ Michoacán de Ocampo
160450001,Jiquilpan de Juárez_ Jiquilpan_ Michoacán de Ocampo
160890001,Tepalcatepec_ Tepalcatepec_ Michoacán de Ocampo
160530086,Morelos_ Morelia_ Michoacán de Ocampo
161020001,Uruapan_ Uruapan_ Michoacán de Ocampo
160440001,Villa Jiménez_ Jiménez_ Michoacán de Ocampo
161130001,Pastor Ortiz_ José Sixto Verduzco_ Michoacán de Ocampo
160880124,Fraccionamiento Galaxia Tarímbaro_ Tarímbaro_ Michoacán de Ocampo
160820001,Tacámbaro de Codallos_ Tacámbaro_ Michoacán de Ocampo
160560001,Nahuatzen_ Nahuatzen_ Michoacán de Ocampo
160660001,Pátzcuaro_ Pátzcuaro_ Michoacán de Ocampo
160340001,Ciudad Hidalgo_ Hidalgo_ Michoacán de Ocampo
160520077,Las Guacamayas_ Lázaro Cárdenas_ Michoacán de Ocampo
160550001,Nueva Italia de Ruiz_ Múgica_ Michoacán de Ocampo
160520001,Ciudad Lázaro Cárdenas_ Lázaro Cárdenas_ Michoacán de Ocampo
160170001,Contepec_ Contepec_ Michoacán de Ocampo
160300001,Ecuandureo_ Ecuandureo_ Michoacán de Ocampo
160060001,Apatzingán de la Constitución_ Apatzingán_ Michoacán de Ocampo
161070001,Zacapu_ Zacapu_ Michoacán de Ocampo
160750001,Los Reyes de Salgado_ Los Reyes_ Michoacán de Ocampo
160930007,San Francisco de los Reyes_ Tlalpujahua_ Michoacán de Ocampo
160980001,Tuxpan_ Tuxpan_ Michoacán de Ocampo
160630001,Panindícuaro_ Panindícuaro_ Michoacán de Ocampo
160580001,Nuevo San Juan Parangaricutiro_ Nuevo Parangaricutiro_ Michoacán de Ocampo
160830001,Tancítaro_ Tancítaro_ Michoacán de Ocampo
160510001,San José de Gracia_ Marcos Castellanos_ Michoacán de Ocampo
160780001,Santa Ana Maya_ Santa Ana Maya_ Michoacán de Ocampo
160120015,Felipe Carrillo Puerto (La Ruana)_ Buenavista_ Michoacán de Ocampo
160600001,Numarán_ Numarán_ Michoacán de Ocampo
160680001,Peribán de Ramos_ Peribán_ Michoacán de Ocampo
161080200,Canindo_ Zamora_ Michoacán de Ocampo
161080007,Chaparaco_ Zamora_ Michoacán de Ocampo
160530108,Puerto de Buenavista (Lázaro Cárdenas)_ Morelia_ Michoacán de Ocampo
160140051,El Ranchito_ Coahuayana_ Michoacán de Ocampo
160140001,Coahuayana de Hidalgo_ Coahuayana_ Michoacán de Ocampo
160740001,Cojumatlán de Régules_ Cojumatlán de Régules_ Michoacán de Ocampo
161060001,Yurécuaro_ Yurécuaro_ Michoacán de Ocampo
160920001,Tiquicheo_ Tiquicheo de Nicolás Romero_ Michoacán de Ocampo
160110004,Paso de Hidalgo (Paso de Álamos)_ Briseñas_ Michoacán de Ocampo
160870001,Taretan_ Taretan_ Michoacán de Ocampo
160790075,Zirahuén_ Salvador Escalante_ Michoacán de Ocampo
160840020,Tarecuato_ Tangamandapio_ Michoacán de Ocampo
160200011,Mariano Escobedo (San Lorenzo)_ Cuitzeo_ Michoacán de Ocampo
161030007,La Palma (La Palma de Jesús)_ Venustiano Carranza_ Michoacán de Ocampo
160330001,Lombardía_ Gabriel Zamora_ Michoacán de Ocampo
161040012,Emiliano Zapata_ Villamar_ Michoacán de Ocampo
161020061,Caltzontzin_ Uruapan_ Michoacán de Ocampo
161020057,Angahuan_ Uruapan_ Michoacán de Ocampo
160710018,Galeana_ Puruándiro_ Michoacán de Ocampo
160370001,Huaniqueo de Morales_ Huaniqueo_ Michoacán de Ocampo
160120001,Buenavista Tomatlán_ Buenavista_ Michoacán de Ocampo
160820066,Pedernales_ Tacámbaro_ Michoacán de Ocampo
160620001,Pajacuarán_ Pajacuarán_ Michoacán de Ocampo
160550014,Gámbara_ Múgica_ Michoacán de Ocampo
160520035,Bahía Bufadero (Caleta de Campos)_ Lázaro Cárdenas_ Michoacán de Ocampo
161080016,La Rinconada_ Zamora_ Michoacán de Ocampo
160350001,La Huacana_ La Huacana_ Michoacán de Ocampo
160790001,Santa Clara del Cobre_ Salvador Escalante_ Michoacán de Ocampo
160900001,Tingambato_ Tingambato_ Michoacán de Ocampo
160190001,Cotija de la Paz_ Cotija_ Michoacán de Ocampo
160770067,Vicente Riva Palacio_ San Lucas_ Michoacán de Ocampo
160250003,Carapan_ Chilchota_ Michoacán de Ocampo
160100001,Arteaga_ Arteaga_ Michoacán de Ocampo
160640003,Antúnez (Morelos)_ Parácuaro_ Michoacán de Ocampo
160150001,Coalcomán de Vázquez Pallares_ Coalcomán de Vázquez Pallares_ Michoacán de Ocampo
160020009,Bonifacio Moreno (El Aguaje)_ Aguililla_ Michoacán de Ocampo
160910001,Tingüindín_ Tingüindín_ Michoacán de Ocampo
160570001,Nocupétaro de Morelos_ Nocupétaro_ Michoacán de Ocampo
160290001,Churumuco de Morelos_ Churumuco_ Michoacán de Ocampo
160700001,Purépero de Echáiz_ Purépero_ Michoacán de Ocampo
161090001,Zináparo_ Zináparo_ Michoacán de Ocampo
160590001,Nuevo Urecho_ Nuevo Urecho_ Michoacán de Ocampo
161030003,Cumuatillo_ Venustiano Carranza_ Michoacán de Ocampo
160210001,Charapan_ Charapan_ Michoacán de Ocampo
161050001,Vista Hermosa de Negrete_ Vista Hermosa_ Michoacán de Ocampo
160300018,Quiringuicharo (La Hacienda)_ Ecuandureo_ Michoacán de Ocampo
160940001,Tlazazalca_ Tlazazalca_ Michoacán de Ocampo
160250002,Acachuén_ Chilchota_ Michoacán de Ocampo
160280001,Churintzio_ Churintzio_ Michoacán de Ocampo
160080001,Aquila_ Aquila_ Michoacán de Ocampo
160710061,Villachuato_ Puruándiro_ Michoacán de Ocampo
161110009,San Ángel Zurumucapio_ Ziracuaretiro_ Michoacán de Ocampo
160250007,Ichán_ Chilchota_ Michoacán de Ocampo
160210004,Ocumicho_ Charapan_ Michoacán de Ocampo
160340003,Agostitlán_ Hidalgo_ Michoacán de Ocampo
161080173,Ex-Hacienda el Refugio [Fraccionamiento]_ Zamora_ Michoacán de Ocampo
160530040,Capula_ Morelia_ Michoacán de Ocampo
160340122,San Antonio Villalongín_ Hidalgo_ Michoacán de Ocampo
160660100,San Juan Tumbío_ Pátzcuaro_ Michoacán de Ocampo
160990001,Tuzantla_ Tuzantla_ Michoacán de Ocampo
160670001,Penjamillo de Degollado_ Penjamillo_ Michoacán de Ocampo
160100247,Infiernillo (Morelos de Infiernillo)_ Arteaga_ Michoacán de Ocampo
160560002,Arantepacua_ Nahuatzen_ Michoacán de Ocampo
161040028,El Platanal_ Villamar_ Michoacán de Ocampo
161100001,Zinapécuaro de Figueroa_ Zinapécuaro_ Michoacán de Ocampo
160120013,Catalinas (Francisco Villa)_ Buenavista_ Michoacán de Ocampo
160860001,Tanhuato de Guerrero_ Tanhuato_ Michoacán de Ocampo
161080005,Atecucario de la Constitución (Atecuario)_ Zamora_ Michoacán de Ocampo
160840001,Santiago Tangamandapio_ Tangamandapio_ Michoacán de Ocampo
160020001,Aguililla_ Aguililla_ Michoacán de Ocampo
160220019,La Goleta_ Charo_ Michoacán de Ocampo
160880001,Tarímbaro_ Tarímbaro_ Michoacán de Ocampo
160880114,Real Hacienda (Metrópolis)_ Tarímbaro_ Michoacán de Ocampo
160640001,Parácuaro_ Parácuaro_ Michoacán de Ocampo
160160001,Coeneo de la Libertad_ Coeneo_ Michoacán de Ocampo
160950040,Santa Clara de Valladares_ Tocumbo_ Michoacán de Ocampo
160520127,La Mira_ Lázaro Cárdenas_ Michoacán de Ocampo
160010001,Acuitzio del Canje_ Acuitzio_ Michoacán de Ocampo
160610001,Ocampo_ Ocampo_ Michoacán de Ocampo
160650001,Paracho de Verduzco_ Paracho_ Michoacán de Ocampo
160250005,Huáncito_ Chilchota_ Michoacán de Ocampo
160490001,Villa Madero_ Madero_ Michoacán de Ocampo
160520028,Buenos Aires_ Lázaro Cárdenas_ Michoacán de Ocampo
160950001,Tocumbo_ Tocumbo_ Michoacán de Ocampo
160360001,Huandacareo_ Huandacareo_ Michoacán de Ocampo
160110001,Briseñas de Matamoros_ Briseñas_ Michoacán de Ocampo
160220001,Charo_ Charo_ Michoacán de Ocampo
160750013,Pamatácuaro_ Los Reyes_ Michoacán de Ocampo
160880132,Fraccionamiento Puerta del Sol_ Tarímbaro_ Michoacán de Ocampo
160520137,La Orilla_ Lázaro Cárdenas_ Michoacán de Ocampo
161040001,Villamar_ Villamar_ Michoacán de Ocampo
160840004,La Cantera_ Tangamandapio_ Michoacán de Ocampo
160350113,Zicuirán_ La Huacana_ Michoacán de Ocampo
160260001,Villa Victoria_ Chinicuila_ Michoacán de Ocampo
160200001,Cuitzeo del Porvenir_ Cuitzeo_ Michoacán de Ocampo
160970158,Puruarán_ Turicato_ Michoacán de Ocampo
161110001,Ziracuaretiro_ Ziracuaretiro_ Michoacán de Ocampo
160320001,Erongarícuaro_ Erongarícuaro_ Michoacán de Ocampo
160390001,Huiramba_ Huiramba_ Michoacán de Ocampo
160790045,Opopeo_ Salvador Escalante_ Michoacán de Ocampo
160970001,Turicato_ Turicato_ Michoacán de Ocampo
160420001,Ixtlán de los Hervores_ Ixtlán_ Michoacán de Ocampo
160850017,Patamban (Patambam)_ Tangancícuaro_ Michoacán de Ocampo
161020106,San Lorenzo_ Uruapan_ Michoacán de Ocampo
160130001,Carácuaro de Morelos_ Carácuaro_ Michoacán de Ocampo
160340133,San Pedro Jácuaro (Las Joyas)_ Hidalgo_ Michoacán de Ocampo
161000001,Tzintzuntzan_ Tzintzuntzan_ Michoacán de Ocampo
160500070,Tungareo_ Maravatío_ Michoacán de Ocampo
160050001,Mineral de Angangueo_ Angangueo_ Michoacán de Ocampo
160760055,San Miguel [Fraccionamiento]_ Sahuayo_ Michoacán de Ocampo
161100048,Ucareo_ Zinapécuaro_ Michoacán de Ocampo
160930001,Tlalpujahua de Rayón_ Tlalpujahua_ Michoacán de Ocampo
160900007,San Francisco Pichátaro_ Tingambato_ Michoacán de Ocampo
161020119,Toreo Bajo (El Toreo Bajo)_ Uruapan_ Michoacán de Ocampo
160660009,Cuanajo_ Pátzcuaro_ Michoacán de Ocampo
161050004,El Capulín_ Vista Hermosa_ Michoacán de Ocampo
161020110,Santa Rosa (Santa Bárbara)_ Uruapan_ Michoacán de Ocampo
160660013,Santa María Huiramangaro (San Juan Tumbio)_ Pátzcuaro_ Michoacán de Ocampo
160340130,San Matías Grande_ Hidalgo_ Michoacán de Ocampo
160880017,Cuto del Porvenir_ Tarímbaro_ Michoacán de Ocampo
160620006,La Luz_ Pajacuarán_ Michoacán de Ocampo
160310001,Epitacio Huerta_ Epitacio Huerta_ Michoacán de Ocampo
160660079,Colonia Vista Bella (Lomas del Peaje)_ Pátzcuaro_ Michoacán de Ocampo
160880145,Fraccionamiento Metrópolis II_ Tarímbaro_ Michoacán de Ocampo
160400001,Indaparapeo_ Indaparapeo_ Michoacán de Ocampo
160460001,Benito Juárez_ Juárez_ Michoacán de Ocampo
160450019,Los Remedios_ Jiquilpan_ Michoacán de Ocampo
160070001,Aporo_ Aporo_ Michoacán de Ocampo
160430004,El Platanal (La Planta)_ Jacona_ Michoacán de Ocampo
160880039,Uruétaro_ Tarímbaro_ Michoacán de Ocampo
160530074,Jesús del Monte (La Capilla)_ Morelia_ Michoacán de Ocampo
160560008,Sevina_ Nahuatzen_ Michoacán de Ocampo
160200005,Cuaracurio_ Cuitzeo_ Michoacán de Ocampo
161130012,San José Huipana_ José Sixto Verduzco_ Michoacán de Ocampo
160030001,Álvaro Obregón_ Álvaro Obregón_ Michoacán de Ocampo
160520158,Playa Azul_ Lázaro Cárdenas_ Michoacán de Ocampo
161100049,Valle de Juárez (Jeráhuaro)_ Zinapécuaro_ Michoacán de Ocampo
160410009,La Frontera_ Irimbo_ Michoacán de Ocampo
160400018,San Lucas Pío_ Indaparapeo_ Michoacán de Ocampo
161100006,Bocaneo (San Pedro)_ Zinapécuaro_ Michoacán de Ocampo
161130016,San Martín_ José Sixto Verduzco_ Michoacán de Ocampo
160620013,San Gregorio_ Pajacuarán_ Michoacán de Ocampo
161070020,Naranja de Tapia_ Zacapu_ Michoacán de Ocampo
160560009,Turícuaro_ Nahuatzen_ Michoacán de Ocampo
160480001,Lagunillas_ Lagunillas_ Michoacán de Ocampo
160180001,Copándaro de Galeana_ Copándaro_ Michoacán de Ocampo
160340041,San Bartolo Cuitareo_ Hidalgo_ Michoacán de Ocampo
161010001,Tzitzio_ Tzitzio_ Michoacán de Ocampo
160650006,Nurio_ Paracho_ Michoacán de Ocampo
160410031,Tzintzingareo_ Irimbo_ Michoacán de Ocampo
160770001,San Lucas_ San Lucas_ Michoacán de Ocampo
161000009,Ihuatzio_ Tzintzuntzan_ Michoacán de Ocampo
160500062,Santiago Puriatzícuaro_ Maravatío_ Michoacán de Ocampo
160970074,La Ermita (Nueva Jerusalén)_ Turicato_ Michoacán de Ocampo
160450023,San Martín Totolán_ Jiquilpan_ Michoacán de Ocampo
161120082,Rincón de Nicolás Romero (Cedros Tercera Manzana)_ Zitácuaro_ Michoacán de Ocampo
161020070,Corupo_ Uruapan_ Michoacán de Ocampo
160210002,Cocucho_ Charapan_ Michoacán de Ocampo
160240004,Tanaco_ Cherán_ Michoacán de Ocampo
160560003,Comachuén_ Nahuatzen_ Michoacán de Ocampo
160880038,Téjaro de los Izquierdo_ Tarímbaro_ Michoacán de Ocampo
161120207,Zitácuaro [Parque Industrial]_ Zitácuaro_ Michoacán de Ocampo
160530438,San Antonio_ Morelia_ Michoacán de Ocampo
160810001,Susupuato de Guerrero_ Susupuato_ Michoacán de Ocampo
160650008,Quinceo_ Paracho_ Michoacán de Ocampo
160500049,San Cristóbal de las Piedras_ Maravatío_ Michoacán de Ocampo
170030001,Axochiapan_ Axochiapan_ Morelos
170070001,Cuernavaca_ Cuernavaca_ Morelos
170110001,Jiutepec_ Jiutepec_ Morelos
170290013,Oaxtepec_ Yautepec_ Morelos
170290001,Yautepec de Zaragoza_ Yautepec_ Morelos
170090001,Huitzilac_ Huitzilac_ Morelos
170330001,Temoac_ Temoac_ Morelos
170300021,Adolfo López Mateos_ Yecapixtla_ Morelos
170300001,Yecapixtla_ Yecapixtla_ Morelos
170150001,Miacatlán_ Miacatlán_ Morelos
170170008,San José Vista Hermosa_ Puente de Ixtla_ Morelos
170100001,Jantetelco_ Jantetelco_ Morelos
170320001,Zacualpan de Amilpas_ Zacualpan de Amilpas_ Morelos
170280006,Chiconcuac_ Xochitepec_ Morelos
170100002,Amayuca_ Jantetelco_ Morelos
170190001,Tepalcingo_ Tepalcingo_ Morelos
170280001,Xochitepec_ Xochitepec_ Morelos
170130001,Jonacatepec de Leandro Valle_ Jonacatepec de Leandro Valle_ Morelos
170090017,Tres Marías_ Huitzilac_ Morelos
170170001,Puente de Ixtla_ Puente de Ixtla_ Morelos
170040026,Tenextepango_ Ayala_ Morelos
170310001,Zacatepec de Hidalgo_ Zacatepec_ Morelos
170040004,Anenecuilco_ Ayala_ Morelos
170280030,Unidad Habitacional José María Morelos y Pavón_ Xochitepec_ Morelos
170240013,Santa Rosa Treinta_ Tlaltizapán de Zapata_ Morelos
170160005,Jumiltepec_ Ocuituco_ Morelos
170290005,Cocoyoc_ Yautepec_ Morelos
170040005,San Pedro Apatlaco_ Ayala_ Morelos
170200006,Santa Catarina_ Tepoztlán_ Morelos
170120012,Tequesquitengo_ Jojutla_ Morelos
170190002,Atotonilco_ Tepalcingo_ Morelos
170080005,Tres de Mayo_ Emiliano Zapata_ Morelos
170290003,Los Arcos_ Yautepec_ Morelos
170170007,Tilzapotla_ Puente de Ixtla_ Morelos
170060078,Tierra Larga_ Cuautla_ Morelos
170300018,Xochitlán_ Yecapixtla_ Morelos
170360001,Barrio de San Miguel_ Hueyapan_ Morelos
170160001,Ocuituco_ Ocuituco_ Morelos
170050001,Coatlán del Río_ Coatlán del Río_ Morelos
170120011,Tehuixtla_ Jojutla_ Morelos
170280113,Real del Puente (El Gallito)_ Xochitepec_ Morelos
170280002,Alpuyeca_ Xochitepec_ Morelos
170190005,Ixtlilco el Grande_ Tepalcingo_ Morelos
170350001,Xoxocotla Centro_ Xoxocotla_ Morelos
170010001,Amacuzac_ Amacuzac_ Morelos
170030010,Telixtac_ Axochiapan_ Morelos
170060032,Peña Flores (Palo Verde)_ Cuautla_ Morelos
170120123,Fraccionamiento el Proa_ Jojutla_ Morelos
170290153,El Potrero_ Yautepec_ Morelos
170270001,Totolapan_ Totolapan_ Morelos
170250001,Tlaquiltenango_ Tlaquiltenango_ Morelos
170180051,Campo el Rayo (Acatlipa)_ Temixco_ Morelos
170330002,Amilcingo_ Temoac_ Morelos
170040014,Moyotepec_ Ayala_ Morelos
170040008,Chinameca_ Ayala_ Morelos
170210001,Tetecala_ Tetecala_ Morelos
170300008,Juan Morales_ Yecapixtla_ Morelos
170230001,Tlalnepantla_ Tlalnepantla_ Morelos
170110009,Progreso_ Jiutepec_ Morelos
170240001,Tlaltizapán_ Tlaltizapán de Zapata_ Morelos
170020001,Atlatlahucan_ Atlatlahucan_ Morelos
170260001,Tlayacapan_ Tlayacapan_ Morelos
170290058,Colonia el Ángel (Kilómetro 33)_ Yautepec_ Morelos
170310022,Colonia Guadalupe Victoria_ Zacatepec_ Morelos
170290012,Oacalco_ Yautepec_ Morelos
170120036,Los Pilares_ Jojutla_ Morelos
170080050,Crucero Tezoyuca_ Emiliano Zapata_ Morelos
170330003,Huazulco_ Temoac_ Morelos
170340001,Coatetelco Centro_ Coatetelco_ Morelos
170010008,San Gabriel las Palmas_ Amacuzac_ Morelos
170070125,Fraccionamiento Lomas de Ahuatlán_ Cuernavaca_ Morelos
170120008,Pedro Amaro_ Jojutla_ Morelos
170120013,Tlatenchi_ Jojutla_ Morelos
170030003,Atlacahualoya_ Axochiapan_ Morelos
170110004,Calera Chica_ Jiutepec_ Morelos
170350020,Las Flores (La Xóchitl)_ Xoxocotla_ Morelos
170310005,San Antonio Chiverías_ Zacatepec_ Morelos
170280003,Atlacholoaya_ Xochitepec_ Morelos
170310002,San Nicolás Galeana_ Zacatepec_ Morelos
170290024,La Joya_ Yautepec_ Morelos
170020008,Colonia Kilómetro 88_ Atlatlahucan_ Morelos
170120004,Higuerón_ Jojutla_ Morelos
170130006,Tetelilla_ Jonacatepec de Leandro Valle_ Morelos
170180004,Cuentepec_ Temixco_ Morelos
170320006,Tlacotepec_ Zacualpan de Amilpas_ Morelos
170020033,Fraccionamiento Lomas de Cocoyoc_ Atlatlahucan_ Morelos
170040012,Jaloxtoc_ Ayala_ Morelos
170240007,Huatecalco_ Tlaltizapán de Zapata_ Morelos
170080004,Tezoyuca_ Emiliano Zapata_ Morelos
170080003,Tetecalita_ Emiliano Zapata_ Morelos
170080063,Colonia Guadalupe de las Arenas_ Emiliano Zapata_ Morelos
170120018,Unidad Habitacional José María Morelos y Pavón_ Jojutla_ Morelos
170240012,Ticumán_ Tlaltizapán de Zapata_ Morelos
170070075,Villa Santiago_ Cuernavaca_ Morelos
170020025,Colonia San Francisco_ Atlatlahucan_ Morelos
170200102,Unidad Habitacional Rinconada Acolapa_ Tepoztlán_ Morelos
170310037,Campo la Victoria_ Zacatepec_ Morelos
170110028,Independencia_ Jiutepec_ Morelos
180200088,San Vicente_ Bahía de Banderas_ Nayarit
180200013,Bucerías_ Bahía de Banderas_ Nayarit
180160041,Quimichis_ Tecuala_ Nayarit
180150082,Yago_ Santiago Ixcuintla_ Nayarit
180150080,Villa Hidalgo_ Santiago Ixcuintla_ Nayarit
180140001,Santa María del Oro_ Santa María del Oro_ Nayarit
180010001,Acaponeta_ Acaponeta_ Nayarit
180170151,San Cayetano_ Tepic_ Nayarit
180200084,San Juan de Abajo_ Bahía de Banderas_ Nayarit
180200053,Mezcales_ Bahía de Banderas_ Nayarit
180040186,Las Varas_ Compostela_ Nayarit
180150001,Santiago Ixcuintla_ Santiago Ixcuintla_ Nayarit
180200092,Sayulita_ Bahía de Banderas_ Nayarit
180200083,San José del Valle_ Bahía de Banderas_ Nayarit
180040191,Zacualpan_ Compostela_ Nayarit
180120001,San Blas_ San Blas_ Nayarit
180040001,Compostela_ Compostela_ Nayarit
180170122,Francisco I. Madero (Puga)_ Tepic_ Nayarit
180030001,Amatlán de Cañas_ Amatlán de Cañas_ Nayarit
180040322,Paraíso Escondido [Colonia]_ Compostela_ Nayarit
180150032,Pozo de Ibarra_ Santiago Ixcuintla_ Nayarit
180200081,San Francisco_ Bahía de Banderas_ Nayarit
180150021,Los Corchos_ Santiago Ixcuintla_ Nayarit
180040016,Altavista_ Compostela_ Nayarit
180200069,El Porvenir_ Bahía de Banderas_ Nayarit
180180012,Palma Grande_ Tuxpan_ Nayarit
180190167,Puente de Camotlán_ La Yesca_ Nayarit
180100035,San Vicente_ Rosamorada_ Nayarit
180200106,Corral del Risco (Punta de Mita)_ Bahía de Banderas_ Nayarit
180070022,Jomulco_ Jala_ Nayarit
180120005,La Bajada_ San Blas_ Nayarit
180200027,Cruz de Huanacaxtle_ Bahía de Banderas_ Nayarit
180150069,Sentispac_ Santiago Ixcuintla_ Nayarit
180200098,Tondoroque_ Bahía de Banderas_ Nayarit
180120003,Aticama_ San Blas_ Nayarit
180110001,Ruiz_ Ruíz_ Nayarit
180040154,Rincón de Guayabitos_ Compostela_ Nayarit
180160001,Tecuala_ Tecuala_ Nayarit
180050001,Huajicori_ Huajicori_ Nayarit
180200001,Valle de Banderas_ Bahía de Banderas_ Nayarit
180200037,El Guamúchil_ Bahía de Banderas_ Nayarit
180200059,Nuevo Vallarta_ Bahía de Banderas_ Nayarit
180040128,La Peñita de Jaltemba_ Compostela_ Nayarit
180020001,Ahuacatlán_ Ahuacatlán_ Nayarit
180040112,Monteón_ Compostela_ Nayarit
180120043,Santa Cruz de Miramar_ San Blas_ Nayarit
180150007,Boca de Camichín_ Santiago Ixcuintla_ Nayarit
180120032,Mecatán_ San Blas_ Nayarit
180150052,La Presa_ Santiago Ixcuintla_ Nayarit
180190001,La Yesca_ La Yesca_ Nayarit
180100001,Rosamorada_ Rosamorada_ Nayarit
180140031,La Labor_ Santa María del Oro_ Nayarit
180200049,San Clemente de Lima_ Bahía de Banderas_ Nayarit
180200043,Las Jarretaderas_ Bahía de Banderas_ Nayarit
180080015,Pantanal_ Xalisco_ Nayarit
180090001,Jesús María_ Del Nayar_ Nayarit
180080021,Testerazo_ Xalisco_ Nayarit
180150056,Puerta de Mangos_ Santiago Ixcuintla_ Nayarit
180150009,Campo de los Limones_ Santiago Ixcuintla_ Nayarit
180120025,Jalcocotán_ San Blas_ Nayarit
180120019,Guadalupe Victoria_ San Blas_ Nayarit
180200046,Lo de Marcos_ Bahía de Banderas_ Nayarit
180130001,San Pedro Lagunillas_ San Pedro Lagunillas_ Nayarit
180180004,Coamiles_ Tuxpan_ Nayarit
180040605,El Crucero de Chacala_ Compostela_ Nayarit
180150067,Santa Rosa_ Santiago Ixcuintla_ Nayarit
180200041,Higuera Blanca_ Bahía de Banderas_ Nayarit
180030025,Estancia de los López_ Amatlán de Cañas_ Nayarit
180150081,Villa Juárez_ Santiago Ixcuintla_ Nayarit
180120035,La Palma_ San Blas_ Nayarit
180070035,Rosa Blanca_ Jala_ Nayarit
180070001,Jala_ Jala_ Nayarit
180160031,Novillero_ Tecuala_ Nayarit
180200300,El Manguito [Colonia]_ Bahía de Banderas_ Nayarit
180170106,Bellavista_ Tepic_ Nayarit
180040020,Los Ayala_ Compostela_ Nayarit
180160047,San Felipe Aztatán_ Tecuala_ Nayarit
180200047,Las Lomas_ Bahía de Banderas_ Nayarit
180040184,Úrsulo Galván_ Compostela_ Nayarit
180040119,Otates y Cantarranas_ Compostela_ Nayarit
180040036,Cándido Salazar_ Compostela_ Nayarit
180040083,Ixtapa de la Concepción_ Compostela_ Nayarit
180120029,El Llano_ San Blas_ Nayarit
180040126,Mesillas_ Compostela_ Nayarit
180150011,Cañada del Tabaco_ Santiago Ixcuintla_ Nayarit
180040093,Lima de Abajo_ Compostela_ Nayarit
180040325,San Isidro_ Compostela_ Nayarit
180200082,San Ignacio_ Bahía de Banderas_ Nayarit
180040125,Paso de las Palmas_ Compostela_ Nayarit
180040065,Chacala_ Compostela_ Nayarit
180120016,La Chiripa_ San Blas_ Nayarit
180120045,Tecuitata_ San Blas_ Nayarit
180150074,Toro Mocho_ Santiago Ixcuintla_ Nayarit
180120011,El Cora_ San Blas_ Nayarit
180040039,El Capomo_ Compostela_ Nayarit
180040189,Villa Morelos_ Compostela_ Nayarit
180040132,Las Piedras_ Compostela_ Nayarit
180040141,La Puerta de la Lima_ Compostela_ Nayarit
180150044,Los Otates_ Santiago Ixcuintla_ Nayarit
180120010,José María Mercado_ San Blas_ Nayarit
190190001,San Pedro Garza García_ San Pedro Garza García_ Nuevo León
190180001,García_ García_ Nuevo León
190480001,Ciudad Santa Catarina_ Santa Catarina_ Nuevo León
190310001,Ciudad Benito Juárez_ Juárez_ Nuevo León
190070001,Aramberri_ Aramberri_ Nuevo León
190310045,Jardines de la Silla (Jardines)_ Juárez_ Nuevo León
190090001,Cadereyta Jiménez_ Cadereyta Jiménez_ Nuevo León
190440001,Ciudad Sabinas Hidalgo_ Sabinas Hidalgo_ Nuevo León
190180212,Mitras Poniente_ García_ Nuevo León
190170001,Galeana_ Galeana_ Nuevo León
190120001,Ciénega de Flores_ Ciénega de Flores_ Nuevo León
190470001,Hidalgo_ Hidalgo_ Nuevo León
190040001,Ciudad de Allende_ Allende_ Nuevo León
190330001,Linares_ Linares_ Nuevo León
190220001,Ciudad General Terán_ General Terán_ Nuevo León
190180040,Alta Villa_ García_ Nuevo León
190450001,Salinas Victoria_ Salinas Victoria_ Nuevo León
190180025,Valle de Lincoln_ García_ Nuevo León
190310224,Héctor Caballero_ Juárez_ Nuevo León
190050001,Anáhuac_ Anáhuac_ Nuevo León
190290001,Hualahuises_ Hualahuises_ Nuevo León
190250284,Fraccionamiento Real Palmas_ General Zuazua_ Nuevo León
190100001,Carmen_ El Carmen_ Nuevo León
190280001,Higueras_ Higueras_ Nuevo León
190060392,Misión San Pablo_ Apodaca_ Nuevo León
190250293,Villas de Alcalá_ General Zuazua_ Nuevo León
190310313,Arboledas de San Roque_ Juárez_ Nuevo León
190180105,Parque Industrial Ciudad Mitras_ García_ Nuevo León
190060388,Ex-Hacienda Santa Rosa_ Apodaca_ Nuevo León
190080001,Bustamante_ Bustamante_ Nuevo León
190060385,Fraccionamiento Cosmópolis Octavo Sector_ Apodaca_ Nuevo León
190250001,General Zuazua_ General Zuazua_ Nuevo León
190200001,General Bravo_ General Bravo_ Nuevo León
190510001,Ciudad de Villaldama_ Villaldama_ Nuevo León
190060243,Entronque Laredo-Salinas Victoria_ Apodaca_ Nuevo León
190210153,Praderas de San Francisco_ General Escobedo_ Nuevo León
190060379,Prados de Santa Rosa_ Apodaca_ Nuevo León
190410337,Colinas del Aeropuerto_ Pesquería_ Nuevo León
190060133,Santa Rosa_ Apodaca_ Nuevo León
190110001,Ciudad Cerralvo_ Cerralvo_ Nuevo León
190180234,Los Parques_ García_ Nuevo León
190120211,Real del Sol_ Ciénega de Flores_ Nuevo León
190060389,Fraccionamiento Misión de San Javier_ Apodaca_ Nuevo León
190450405,Simeprodeso (Colectivo Nuevo)_ Salinas Victoria_ Nuevo León
190480166,Microempresarios del Poniente [Parque Industrial]_ Santa Catarina_ Nuevo León
190270001,Los Herreras_ Los Herreras_ Nuevo León
190060411,Aeropuerto Internacional de Monterrey_ Apodaca_ Nuevo León
190310311,Monte Kristal_ Juárez_ Nuevo León
190170153,San Rafael_ Galeana_ Nuevo León
190180064,Rancho de Enmedio (Las Mitras)_ García_ Nuevo León
190210137,Monclova Primer Sector_ General Escobedo_ Nuevo León
190420001,Los Ramones_ Los Ramones_ Nuevo León
190210140,Monclova Segundo Sector_ General Escobedo_ Nuevo León
190370001,Mina_ Mina_ Nuevo León
190450241,Ciudad Satélite del Norte_ Salinas Victoria_ Nuevo León
190060078,Loma la Paz_ Apodaca_ Nuevo León
190230001,General Treviño_ General Treviño_ Nuevo León
190320001,Lampazos de Naranjo_ Lampazos de Naranjo_ Nuevo León
190070008,La Ascención_ Aramberri_ Nuevo León
190310348,Valle de Vaquerías_ Juárez_ Nuevo León
190180236,Santa María_ García_ Nuevo León
190410001,Pesquería_ Pesquería_ Nuevo León
190240001,General Zaragoza_ General Zaragoza_ Nuevo León
190450385,Emiliano Zapata_ Salinas Victoria_ Nuevo León
190180187,Las Torres de Guadalupe_ García_ Nuevo León
190170090,Catarino Rodríguez (El Potosí)_ Galeana_ Nuevo León
190020001,Agualeguas_ Agualeguas_ Nuevo León
190100131,Alianza Real_ El Carmen_ Nuevo León
190210155,Palmiras_ General Escobedo_ Nuevo León
190500001,Vallecillo_ Vallecillo_ Nuevo León
190150001,Doctor Coss_ Doctor Coss_ Nuevo León
190250294,Hacienda San Pedro_ General Zuazua_ Nuevo León
190340001,Marín_ Marín_ Nuevo León
190360001,Mier y Noriega_ Mier y Noriega_ Nuevo León
190010001,Abasolo_ Abasolo_ Nuevo León
204010050,Brisas de Zicatela_ Santa María Colotepec_ Oaxaca
201840001,San Juan Bautista Tuxtepec_ San Juan Bautista Tuxtepec_ Oaxaca
205150001,Santo Domingo Tehuantepec_ Santo Domingo Tehuantepec_ Oaxaca
204010001,Santa María Colotepec_ Santa María Colotepec_ Oaxaca
200140001,Ciudad Ixtepec_ Ciudad Ixtepec_ Oaxaca
200750001,Reforma de Pineda_ Reforma de Pineda_ Oaxaca
200670001,Oaxaca de Juárez_ Oaxaca de Juárez_ Oaxaca
203820001,Santa Cruz Tacahua_ Santa Cruz Tacahua_ Oaxaca
205260001,Santos Reyes Nopala_ Santos Reyes Nopala_ Oaxaca
